Theme,Questions,Answer
Signs of Ovulation,How can I know when I am ovulating?,"You can tell you are ovulating by noticing changes in your body. Many women feel mild pain in their lower belly, have more clear and stretchy mucus, and may notice a slight increase in body temperature. These signs usually happen in the middle of your menstrual cycle. Tracking these changes can help you understand your fertile days if you are trying to get pregnant."
Nutrition During Pregnancy,What should I eat for a healthy pregnancy?,"Eating a balanced diet is important during pregnancy. Focus on foods rich in iron, like spinach and lentils, to prevent anemia. Include fruits and vegetables for vitamins, dairy for calcium, and whole grains for energy. Eating small, frequent meals can help manage nausea. Always drink plenty of water to stay hydrated. Discuss your diet with a health worker for personalized advice."
Breastfeeding Benefits,Why is breastfeeding good for my baby?,Breastfeeding provides your baby with the best nutrition and helps them grow strong. Breast milk has all the necessary nutrients and antibodies that protect your baby from infections. It also helps build a close bond between you and your baby. Experts recommend breastfeeding exclusively for the first six months for optimal health benefits.
Postpartum Recovery,How do I heal and get my strength back after birth?,"After giving birth, take time to rest and heal. Eat nutritious foods to help your body recover, especially iron-rich foods to replenish your strength. Drink plenty of water and try to sleep when your baby sleeps. Light exercise, like walking, can help improve your mood and energy. Don't hesitate to ask for help from family or friends during this time."
Family Planning Methods,What are some safe family planning methods I can use?,"Family planning methods help you decide when to have children. Some safe options include condoms, which also protect against infections, and birth control pills. There are also long-term methods like IUDs. It is important to talk to a health worker to find the best method for you, considering your health and family plans."
Signs of Pregnancy,What are the early signs of pregnancy I should look for?,"Early signs of pregnancy include missed periods, nausea, breast tenderness, and feeling very tired. Some women may also notice frequent urination or mood changes. If you think you might be pregnant, taking a home pregnancy test or visiting a health worker can help confirm it. Remember to start taking prenatal vitamins if you are pregnant."
Managing Stress During Pregnancy,How can I manage stress during my pregnancy?,"Managing stress is important for a healthy pregnancy. You can try relaxation techniques like deep breathing, gentle yoga, or meditation. Talking to family or friends can also help. Make time for activities you enjoy, like listening to music or reading. If stress feels overwhelming, consider discussing it with a health worker who can offer support and advice."
Importance of Prenatal Check-ups,Why are prenatal check-ups important during pregnancy?,"Prenatal check-ups are important for monitoring your health and your baby's growth. They help identify any problems early, such as high blood pressure or low iron levels. Regular visits allow your doctor to provide guidance on diet, exercise, and any necessary tests. These check-ups help ensure both you and your baby stay healthy throughout the pregnancy."
Signs of Labor,How will I know when labor starts?,"You may know labor is starting if you feel regular contractions that become stronger and closer together. Other signs include a ""bloody show,"" which is a pink or brown discharge, and your water breaking, which means fluid leaks from the bag around the baby. If you notice these signs, it’s important to go to the healthcare facility for help. Don’t hesitate to call your healthcare worker if you're unsure."
Breastfeeding Benefits,What are the benefits of breastfeeding for my baby?,"Breastfeeding is very good for your baby because it provides all the essential nutrients and antibodies that help protect against sickness. It also helps your baby grow healthy and strong. Breast milk is easy for babies to digest and can even reduce the risk of allergies and infections. Plus, breastfeeding creates a special bond between you and your baby, making them feel loved and secure."
Postnatal Care Importance,Why is postnatal care important after giving birth?,"Postnatal care is important because it helps you recover from childbirth and ensures that you are healthy. It also checks on your baby’s growth and development. During this time, you can discuss any challenges you face, like breastfeeding or mood changes. Regular check-ups can catch any problems early, making it easier to take care of yourself and your baby. Always keep your appointments with your healthcare provider."
Contraceptive Methods,What are some safe contraceptive methods I can use?,"There are several safe contraceptive methods you can use to prevent pregnancy. Some common options include birth control pills, condoms, and the intrauterine device (IUD). Each method has its own benefits, so it’s important to talk to your healthcare provider about which one is best for you. Using condoms also helps protect against sexually transmitted infections, which is an added benefit."
Healthy Diet During Pregnancy,What should I eat to stay healthy during pregnancy?,"Eating a healthy diet during pregnancy is very important. You should include a variety of foods from all groups: fruits, vegetables, whole grains, lean proteins, and dairy. Focus on iron-rich foods like lentils and spinach, as well as foods high in calcium like milk and yogurt. Drinking enough water is also essential. This will help you and your baby stay healthy and support growth."
Impact of Stress on Pregnancy,How can stress affect my pregnancy?,"Stress during pregnancy can affect both you and your baby. High stress levels may lead to problems like preterm birth or low birth weight. It’s important to find ways to relax, like talking with family, practicing deep breathing, or spending time in nature. If you feel very stressed, speak with your healthcare provider, who can offer support and resources to help you manage your feelings."
Vaccination During Pregnancy,Are vaccinations safe during pregnancy?,"Many vaccinations are safe and recommended during pregnancy, such as the flu shot and Tdap vaccine. They help protect both you and your baby from serious diseases. It is important to discuss vaccinations with your doctor, who can guide you on which ones you should get. Staying up to date on vaccinations can help ensure a healthy pregnancy and baby."
Signs of Postpartum Depression,What are the signs of postpartum depression after having a baby?,"Postpartum depression can happen after childbirth and may cause feelings of sadness, anxiety, or being overwhelmed. You might feel very tired, have trouble sleeping, or lose interest in things you used to enjoy. It can also make it hard to bond with your baby. If you notice these feelings lasting more than a couple of weeks, it’s important to talk to someone you trust or a healthcare worker. Help is available and you don’t have to go through it alone."
Healthy Weight Gain During Pregnancy,How much weight should I gain during pregnancy?,"The amount of weight you should gain during pregnancy depends on your starting weight. If you are of normal weight, gaining about 11 to 16 kg is healthy. If you are underweight, you may need to gain more, while overweight women may need to gain less. Gaining the right amount helps support your baby's growth and keeps you healthy. Eating a balanced diet with fruits, vegetables, and proteins can help you gain the right weight. Always check with your doctor for personalized advice."
Postpartum Recovery and Emotional Health,How can I take care of my mental health after having a baby?,"After having a baby, it’s normal to feel a mix of emotions. You may feel happy, tired, or even sad. It’s important to talk about your feelings with someone you trust, like your husband or a family member. Make time for yourself to relax, and don’t hesitate to seek help from a doctor if you feel very sad or overwhelmed for a long time. Your mental health is just as important as your physical health."
Nutrition During Pregnancy,What foods should I eat for a healthy pregnancy?,"Eating healthy during pregnancy is very important for you and your baby. Focus on eating foods rich in iron, like lentils and green leafy vegetables, to avoid weakness. Include dairy for calcium, which is good for your baby’s bones. Try to consume fruits for vitamins and whole grains for energy. Drinking plenty of water is also essential. A balanced diet helps ensure healthy growth for your baby."
Breastfeeding Benefits,Why is breastfeeding important for my baby?,Breastfeeding is very beneficial for your baby as it provides the right nutrients needed for growth and helps protect against illnesses. It also strengthens the bond between you and your baby. Breast milk is easier to digest and contains antibodies that help keep your baby healthy. Try to breastfeed exclusively for the first six months for the best health results for your child.
Pain Relief During Labor,What can I do for pain relief during labor?,"During labor, there are several ways to manage pain. Breathing exercises and relaxation techniques can help. Walking around and changing positions may also ease discomfort. Some women find comfort in warm baths or using a hot water bag. If you need more help, talk to your healthcare provider about medications available for pain relief. It’s important to find what makes you feel comfortable and safe."
Postnatal Check-up Importance,Why should I have a check-up after giving birth?,"A postnatal check-up is very important for your health after childbirth. It allows the doctor to check how you are healing physically and emotionally. They will look for any complications, like infections or excessive bleeding, and check if you need help with breastfeeding. This check-up also gives you a chance to discuss your feelings and ask questions about caring for your baby."
Family Planning Methods,What are some ways to plan my family?,"There are several family planning methods to help you decide when to have children. These include natural methods, like tracking your menstrual cycle, and modern methods, like birth control pills or condoms. Some women also choose long-term options like IUDs. It’s best to speak with a healthcare provider to find the method that suits your needs and lifestyle best, ensuring your family grows when you are ready."
Understanding Ovulation,"What is ovulation, and why is it important?","Ovulation is when your ovary releases an egg, usually around the middle of your menstrual cycle. It is important because this is the time when you can get pregnant if you have unprotected sex. Knowing when you ovulate helps you plan if you want to conceive. Signs of ovulation can include mild pain in your lower abdomen or changes in your cervical mucus."
Signs of Pregnancy,What are the early signs of pregnancy?,"Early signs of pregnancy can include missed periods, nausea, tiredness, and breast tenderness. Some women may notice they have to urinate more often or feel more emotional. If you think you may be pregnant, a home pregnancy test can help confirm it. It’s a good idea to visit a healthcare provider for further advice and to start your prenatal care."
Dealing with Pregnancy Fatigue,How can I manage fatigue during pregnancy?,"Feeling tired during pregnancy is very common, especially in the first and last trimesters. To manage fatigue, try to rest whenever you can, and take short naps if possible. Eating healthy meals and staying hydrated can also help. Light exercises, like walking, can boost your energy levels. If you feel excessively tired, it’s important to speak with your healthcare provider for further advice."
Signs of Postpartum Depression,How do I know if I have postpartum depression?,"Postpartum depression can show up as feeling very sad, anxious, or overwhelmed after having a baby. You might find it hard to care for yourself or your baby, or you may lose interest in things you enjoyed before. If these feelings last more than two weeks or interfere with your daily life, it’s important to talk to a healthcare provider. They can help you find the support you need."
Understanding Menopause,"What is menopause, and when does it happen?","Menopause is when a woman's periods stop, usually happening between ages 45 and 55. It marks the end of your reproductive years. You might experience symptoms like hot flashes, mood changes, or sleep problems. It's a natural part of life, but if symptoms are difficult, talk to a healthcare provider for advice on managing them."
Importance of Hydration in Pregnancy,Why is drinking water important during pregnancy?,"Staying hydrated during pregnancy is crucial for your health and your baby's. Water helps transport nutrients and oxygen to your baby and keeps your body functioning well. It can also help reduce swelling and prevent constipation. Aim to drink at least 8 glasses of water a day, and more if you are active or in a hot climate. Always listen to your body's thirst signals."
Managing Sleep Issues in Pregnancy,How can I sleep better during pregnancy?,"Sleeping well during pregnancy can be challenging, but there are ways to improve it. Try to create a comfortable sleeping environment, using pillows to support your belly and back. Establish a bedtime routine to relax before sleep. Avoid caffeine and heavy meals close to bedtime. If you continue to have trouble sleeping, discussing it with your doctor can provide helpful advice."
Prenatal Screening Tests,"What are prenatal screening tests, and why are they important?",Prenatal screening tests are done during pregnancy to check for certain health conditions in the baby and assess your health. These tests can identify risks for genetic disorders or other issues early on. They help you and your doctor make informed decisions about your care and prepare for your baby's needs. Always discuss with your healthcare provider which tests are right for you.
Managing Stress During Pregnancy,How can I manage stress while pregnant?,"Managing stress during pregnancy is important for your well-being and your baby's health. Try relaxation techniques like deep breathing, yoga, or meditation. Make time for enjoyable activities and seek support from family or friends. Talk about your feelings with someone you trust. If stress feels overwhelming, consider speaking to a healthcare provider for additional support and resources."
Understanding PCOS,"What is PCOS, and how does it affect my health?","PCOS, or Polycystic Ovary Syndrome, is a common condition that affects women's hormone levels. It can cause irregular periods, weight gain, and acne. Women with PCOS may have difficulty getting pregnant but can often manage symptoms through a healthy diet, exercise, and sometimes medications. It’s important to talk to a healthcare provider for advice on managing PCOS effectively."
Safe Exercise During Pregnancy,Is it safe to exercise during pregnancy?,"Yes, exercising during pregnancy is generally safe and can be very beneficial. Light activities like walking, swimming, or prenatal yoga can help keep you healthy and reduce discomfort. Always listen to your body and avoid high-impact exercises or activities that could lead to falls. Consult with your doctor before starting any new exercise routine to ensure it’s safe for you and your baby."
Breastfeeding Challenges,What should I do if I have trouble breastfeeding?,"If you have trouble breastfeeding, don’t hesitate to ask for help. Contact a healthcare provider or a lactation consultant who can provide support and tips. Common issues include pain, difficulty latching, or low milk supply. Sometimes, making small adjustments can make a big difference. Remember, it’s okay to seek help, and it’s important to find what works best for you and your baby."
Importance of Family Support,How can my family help me during pregnancy and after childbirth?,"Family support is crucial during pregnancy and after childbirth. They can help with daily chores, provide emotional support, and share in baby care. Encourage open communication about your needs and feelings. Having someone to talk to can reduce stress and make this time more enjoyable. Involving family in care and decisions also strengthens bonds and helps everyone adjust to the new changes."
Understanding Your Body After Birth,What changes should I expect in my body after giving birth?,"After giving birth, your body goes through many changes. You may experience bleeding for several weeks as your body heals. Your breasts may feel fuller if you are breastfeeding. Hormonal changes can affect your mood and weight. It’s normal to have ups and downs as you adjust. If you have concerns about your recovery, don’t hesitate to speak with your healthcare provider for guidance."
Importance of Prenatal Vitamins,Why are prenatal vitamins important during pregnancy?,"Prenatal vitamins are very important because they provide essential nutrients like folic acid, iron, and calcium needed for your baby's growth. Folic acid helps prevent birth defects in the brain and spine. Taking these vitamins daily, especially in the first three months, supports your health and helps your baby develop properly. Always talk to your doctor about the right vitamins for you."
Signs of Labor,What are the signs that labor is starting?,"Signs that labor is beginning include regular contractions that become stronger and closer together, a 'bloody show' (mucus with blood), and water breaking (fluid leaking from the vagina). Other signs can be back pain or pressure in the lower abdomen. If you notice these signs, it's important to contact your healthcare provider or go to the hospital for further guidance."
Postpartum Care,What should I do for my health after childbirth?,"After childbirth, it is important to take care of yourself by resting and eating healthy foods. Drink plenty of water and continue taking any vitamins as advised by your doctor. Keep an eye on any bleeding; it should gradually decrease. Don’t hesitate to ask for help from family members. If you feel very sad or overwhelmed, talk to someone you trust or your healthcare provider."
Understanding Ultrasound,"What is an ultrasound, and why do I need it during pregnancy?","An ultrasound is a safe test that uses sound waves to create images of your baby inside the womb. It helps check your baby's growth, heartbeat, and position. Ultrasounds also help find any problems early, so your doctor can address them. You will usually have at least one ultrasound during your pregnancy, often around 20 weeks, to see how your baby is doing."
Signs of Postpartum Depression,What are the signs of postpartum depression?,"Postpartum depression can make you feel very sad, anxious, or overwhelmed after having a baby. Signs include feeling hopeless, trouble sleeping, or not wanting to care for your baby. If you have these feelings for more than two weeks, it is important to talk to a healthcare provider. There is help available, and you don’t have to go through it alone."
Pelvic Floor Exercises,"What are pelvic floor exercises, and why should I do them?","Pelvic floor exercises, also known as Kegel exercises, help strengthen the muscles that support your bladder and uterus. Doing these exercises can help prevent urine leakage after childbirth and improve recovery. It’s easy to do these exercises anywhere, like while sitting or lying down. Regular practice can make a big difference in your comfort and health after delivery."
Menstrual Cycle After Birth,When will my menstrual cycle return after childbirth?,"Your menstrual cycle may take some time to return after childbirth, especially if you are breastfeeding. For some women, it can take several months, while for others, it may return sooner. It’s normal to have irregular periods in the beginning. If you have concerns or if it doesn’t return after a year, consult with your healthcare provider for advice."
Safe Sex After Birth,When can I have sex again after having a baby?,"It is generally safe to have sex again after about 6 weeks postpartum, but it's important to feel ready both physically and emotionally. Your body needs time to heal, especially if you had stitches or a cesarean section. Always discuss this with your doctor at your check-up, and remember to use protection to prevent pregnancy and infections if you are not ready for another baby yet."
Exercising After Birth,Is it safe to exercise after having a baby?,"Yes, exercising after having a baby is safe and can help you feel better, but it’s important to start slowly. Walking is a good way to begin, and you can gradually add more activities as you feel stronger. Always listen to your body and consult with your doctor before starting any exercise routine to ensure it's safe for your recovery."
Understanding Fertility Awareness,"What is fertility awareness, and how can it help me?","Fertility awareness involves tracking your menstrual cycle to understand when you are most fertile. This can help you plan for pregnancy or avoid it. You can track your cycle by noting changes in your body, like temperature and cervical mucus. It’s a natural method, but it requires careful monitoring. Talk to a healthcare provider for guidance on how to use this method effectively."
Signs of Pregnancy Complications,What signs should I watch for that could mean trouble during my pregnancy?,"Watch for signs like severe abdominal pain, heavy bleeding, severe headaches, or blurry vision, as these can indicate complications. Also, if you feel less movement from your baby after 28 weeks, contact your healthcare provider immediately. It’s important to attend regular check-ups to monitor your health and your baby's well-being during pregnancy."
Safe Exercise During Pregnancy,What exercises are safe during pregnancy?,"Safe exercises during pregnancy include walking, swimming, and gentle stretching. These activities can help you stay fit, relieve stress, and improve your mood. It's important to avoid high-impact sports or exercises that could cause injury. Always listen to your body, and if you feel tired or uncomfortable, rest. Discuss any new exercise plans with your healthcare provider for safety."
Preterm Labor Signs,What are the signs of preterm labor I should know about?,"Signs of preterm labor include regular contractions, lower back pain, and changes in vaginal discharge before 37 weeks of pregnancy. If you notice these signs, it is important to contact your healthcare provider right away. Early detection can help ensure the best care for you and your baby, so always trust your instincts and seek help if something feels wrong."
Nutrition for Breastfeeding Mothers,What should I eat while breastfeeding to stay healthy?,"While breastfeeding, it's important to eat a balanced diet. Include plenty of fruits, vegetables, whole grains, and protein-rich foods like lentils and eggs. Drinking enough water is also essential to stay hydrated. Foods rich in calcium, like yogurt and milk, are good for your bones and your baby's growth. A healthy diet helps you produce nutritious milk and keeps you strong."
Family Support During Pregnancy,How can my family support me during my pregnancy?,"Family support is very important during pregnancy. They can help by providing emotional support, helping with household chores, and attending doctor visits with you. Encourage them to learn about pregnancy so they can understand your needs and feelings. Having a supportive environment makes your pregnancy journey easier and more enjoyable, allowing you to focus on your health and your baby's well-being."
Signs of Healthy Pregnancy,What are the signs of a healthy pregnancy?,"Signs of a healthy pregnancy include feeling your baby move, gaining some weight steadily, and having regular check-ups with your healthcare provider. You should feel generally well, with normal energy levels and appetite. If you have any concerns or unusual symptoms, like severe pain or bleeding, contact your doctor right away to ensure everything is okay for you and your baby."
Understanding Contraception,"What is contraception, and why is it important?","Contraception, or birth control, helps prevent pregnancy when you are not ready to have a baby. It’s important because it allows you to plan if and when you want to become a parent. There are many types of contraception, including pills, condoms, and injections. Discuss with your healthcare provider to choose the best method for you, based on your health and family plans."
High Sugar in Pregnancy,I feel more thirsty and tired than usual during pregnancy. Is something wrong,"Sometimes during pregnancy, sugar in the blood can go high. This can make you thirsty, tired, or make you pass urine often. It is important to eat less sweets and oily food, walk daily, and follow what the doctor says. This will keep you and your baby safe."
Importance of Hydration,How important is it to drink water during pregnancy?,"Drinking enough water during pregnancy is very important. It helps support your growing baby, keeps you hydrated, and helps prevent constipation. Aim to drink at least 8–10 glasses of water a day. If you're active or it's hot outside, you may need even more. Staying hydrated can also help reduce swelling and keep your energy levels up."
