Theme,Questions,Answer
Breastfeeding Tips for New Mothers,What should I know about breastfeeding my newborn?,"Breastfeeding is a natural way to feed your baby, and it's important to start soon after birth. Make sure to hold your baby close and allow them to latch properly for comfort. Feed them whenever they show signs of hunger, which is usually often. Stay hydrated and eat healthy foods to help produce milk. If you have concerns, ask your doctor or a family member for guidance."
Pain Management During Labor,How can I manage pain during labor without strong medicines?,"There are many ways to manage pain during labor without strong medicines. Deep breathing, focusing on something you enjoy, and moving around can help. You can also try warm baths or using a hot pack on your back. Having someone you trust, like your husband or a family member, with you can provide extra comfort and support during this time."
Impact of Stress on Pregnancy,How can stress affect me and my baby during pregnancy?,"Stress during pregnancy can make you feel tired and anxious, which may affect your baby's growth. It's vital to find ways to relax, like talking to family, meditating, or taking gentle walks. Connecting with loved ones can help you feel supported. If stress becomes too much, don't hesitate to reach out to your doctor for support and advice."
Family Support in Breastfeeding,How can my family help me with breastfeeding?,"Your family can play a big role in supporting you while breastfeeding. They can help by providing you with a comfortable space to feed your baby, bringing you water, and taking care of other tasks at home so you can focus on feeding. Encourage your family to learn about breastfeeding together, as their understanding can make the experience smoother for you."
Healthy Weight Gain in Pregnancy,How much weight should I aim to gain during my pregnancy?,"Gaining weight during pregnancy is normal and healthy, but the amount varies. Generally, gaining 11 to 16 kg is good for most women. Focus on eating healthy foods rather than just more food. Regular check-ups with your doctor will help ensure that you and your baby are healthy. If you have concerns about weight gain, ask your doctor for specific advice."
Family Involvement in Baby Care,How can my husband and family help with the baby once it arrives?,"Your husband and family can help a lot when the baby arrives. They can take care of chores, hold the baby while you rest, and even help with feeding or bathing. Involving them creates a supportive environment and helps everyone bond with the baby. Open communication about what you need will help everyone feel included and valued during this time."
Signs of a Healthy Pregnancy,How do I know if my pregnancy is going well?,"A healthy pregnancy often means you’re feeling well with normal energy levels. You should notice your baby moving regularly and growing. Regular check-ups will help reassure you that everything is progressing as it should. If you feel any sudden changes, like unusual pains or swelling, talk to your doctor for peace of mind."
Coping with Baby Blues,What should I do if I feel sad after my baby is born?,"Feeling sad after having a baby, often known as the baby blues, is common for many mothers. It's important to talk about your feelings with someone you trust, like your husband or a family member. Rest, healthy foods, and support can help. If feelings of sadness last long or feel overwhelming, don't hesitate to reach out to your doctor for help."
Contraceptive Options After Childbirth,What are my options for family planning once the baby is born?,"After giving birth, there are several ways to plan when to have another baby. You can choose from natural methods, pills, injections, or other options. Talk to your doctor about what would work best for you and your body. Family members can also support you in making these decisions, but choose what feels right for you."
Pain Relief for Post-Delivery Recovery,What can I do to feel better after giving birth?,"After giving birth, feeling sore or tired is normal. Rest as much as you can and ask your family for help with chores. Warm baths can soothe discomfort, and using a cool pack can reduce swelling. Staying hydrated and eating nutritious foods will help your body heal faster. If pain is severe, make sure to speak to your doctor."
Understanding Baby's Needs,How can I tell if my baby is hungry or needs something else?,"Babies may show they are hungry by moving their mouth, sucking their fingers, or making noises. If they cry, it may mean they need something. Look for cues like being fussy or rooting around. Spend time bonding with your baby; over time, you’ll learn what they need. If unsure, it’s always okay to ask for help from someone experienced."
Navigating Family Opinions on Child Care,How do I handle different opinions from my family on raising my baby?,"It's normal for family members to have different opinions on how to raise a baby. It’s important to listen to their advice but also trust your feelings as a new mother. Share your thoughts and let them know what you believe is best for your baby. Open communication can bring understanding, and finding a balance will help your family support you better."
Understanding Baby's Sleep Patterns,"How much sleep does my newborn need, and how can I help them sleep better?","Newborns typically need a lot of sleep, around 16 to 18 hours a day, but they wake frequently for food. Create a calm and comfortable environment for your baby at bedtime. Swaddling, gentle rocking, or soft sounds can help them settle. Be patient as they adjust their sleep patterns over the coming weeks; it takes time for them to develop a routine."
Managing Family Expectations,How can I set healthy boundaries with family regarding my baby’s care?,"Setting boundaries is essential for your well-being and your baby's. Kindly express your needs and preferences to family members, explaining what you feel comfortable with. It’s important to be clear yet gentle. Having open conversations can help everyone understand your choices, leading to better support without confusion or conflict."
Importance of Postnatal Check-Up,Why is it important to see the doctor after having a baby?,"Seeing your doctor after having a baby is very important for your health. This check-up helps ensure you are healing well and addresses any concerns you may have. Your doctor can also provide advice on family planning and caring for your baby. Remember, taking care of yourself is part of taking care of your family."
Maintaining Relationships Post-Baby,How can I keep my relationship strong with my husband after the baby arrives?,"Having a baby can change your relationship, but it's important to make time for each other. Try to talk and spend little moments together, even if it’s just a quick chat when the baby sleeps. Express your feelings and understand each other’s needs. Supporting one another helps maintain a strong bond during this exciting yet challenging time."
Preparing for Delivery,How do I prepare for going to the hospital for delivery?,"Preparing for hospital delivery starts by talking to your family about the plan. Pack a bag with essentials like clothes for you and the baby, toiletries, and any items that make you comfortable, like a pillow. Keep your medical records safe and ready to take with you. It’s helpful to have a partner or family member accompany you. Discuss any worries or questions you have with your healthcare worker as well."
Managing Tiredness During Pregnancy,What can I do if I feel very tired during pregnancy?,"Feeling tired during pregnancy is normal, but there are ways to help. Try to take short naps during the day if you can. Getting enough rest at night is important, so set a regular sleep time. Eating healthy foods, like fruit and nuts, can give you energy. Light exercise, like walking, can also help. Sharing tasks with family members can give you more time to rest."
Signs to Visit a Doctor,When should I go to the doctor during pregnancy?,"You should visit the doctor if you feel very strong pain or if you notice any unusual bleeding. If you have signs like swelling in your hands or face, or if the baby is not moving much, it's time to go to the doctor. Regular checkups are also important, even if you feel fine. Always trust your instincts; if something feels wrong, it's best to consult a healthcare worker."
Family Support During Pregnancy,How can my family help me during my pregnancy?,"Family support is very valuable during pregnancy. They can help with daily tasks, like cooking and cleaning, which allows you to rest more. Having someone to talk to about your feelings is also important. Your family can accompany you to doctor visits or help find answers to questions you may have. When they understand your needs, it creates a loving and supportive environment for you and your baby."
Importance of Breastfeeding,Why should I breastfeed my baby?,"Breastfeeding is very good for your baby. Your milk provides all the nutrients and protection against sickness that they need for healthy growth. It also helps create a special bond between you and your baby. Breastfeeding can save money too, as you won’t need to buy formula. If you have any worries, talk to a healthcare worker for support and tips on how to start."
Contraceptive Options,What are good ways to prevent pregnancy after having a baby?,"After having a baby, it’s important to discuss family planning with your partner and family. There are different methods, like pills, injections, or devices that can help prevent pregnancy. Some women choose to wait a while before having more children, so it’s good to find out what works best for you. Speak to a healthcare worker to understand all options and find the right one for your situation."
Dealing with Mood Swings,Why do I feel sad sometimes after having my baby?,"Feeling sad sometimes after having a baby is normal. Your body is changing, and there are many new feelings and responsibilities. It’s important to talk to someone, like a family member or friend, about how you feel. Sharing your feelings can help you feel better. If sadness continues, don’t hesitate to reach out to a healthcare worker for support and understanding."
Skin Changes During Pregnancy,Why does my skin feel different during pregnancy?,"During pregnancy, your skin may feel different because of the changes happening in your body. You might notice it becoming oily, or some women get dark spots. These changes are usually normal and temporary. Keeping your skin clean and hydrated can help. If you see any unusual marks or rashes, it’s best to talk to a healthcare worker for advice."
Working and Pregnancy,Can I keep working while I am pregnant?,"Yes, you can usually continue working during pregnancy as long as you feel well. It’s important to listen to your body and rest when you need to. If your job involves heavy lifting or stressful activities, discuss options with your employer for any changes. Share your feelings and plans with your family to get their support, which can help make work easier during this time."
Planning for Baby's Arrival,What should I prepare for when my baby comes home?,"Preparing for your baby’s arrival involves gathering essential items like clothes, blankets, diapers, and a safe space for them to sleep. Having healthy food ready for yourself is also important as you will need energy to care for the baby. Discuss with your family about how they can help during this time. This way, everyone can be ready and supportive when the baby arrives."
Handling Stress During Pregnancy,What can I do if I feel stressed during my pregnancy?,"Feeling stressed during pregnancy is common, but there are ways to help. Try to practice deep breathing or take short walks to relax your mind. Sharing your feelings with family members or friends can also lighten the load. Set aside time for yourself to rest or do something you enjoy, as this can help reduce stress. Always remember that it’s okay to ask for support when needed."
Managing Morning Sickness,What can I do to feel better if I have morning sickness?,"If you experience morning sickness, try eating small amounts of dry foods like crackers or toast before getting out of bed. Drinking ginger tea or lemon water can also help settle your stomach. Avoid strong smells that make you feel worse. Rest as much as you can, and share your feelings with family, so they understand what you’re going through and can support you better."
Community Support for New Mothers,How can my community help me after my baby is born?,"Your community can be a great support after your baby is born. Neighbors can help with cooking or bringing food, and friends may visit to check on you. Joining local mother groups can provide companionship. Sharing experiences with others can make you feel connected and less alone. Don’t hesitate to ask for help, as this can create a strong support network during your recovery."
Vaccination for New Mothers,Do I need any vaccinations after having my baby?,"Yes, after having your baby, you may need some vaccinations to protect yourself and your baby. Common vaccines include those for diseases that can affect new mothers. It’s good to talk to a healthcare worker about which vaccines are needed. Keeping yourself healthy is important to ensure you have the strength to care for your baby, so don’t hesitate to ask for guidance."
Sharing Parenting Responsibilities,How can my husband help with our new baby?,"Your husband can be a big help with the baby by changing diapers, soothing, and holding the baby. He can also share housework and cooking, which will give you more time to rest. Communication is key, so discuss with him how he can support you best. When both partners are involved, parenting becomes easier and creates a stronger family bond."
Postpartum Weight Changes,What should I expect with my weight after having a baby?,"After having a baby, it’s common for your weight to change. You may lose some weight quickly, but it can take time for your body to return to its previous shape. Focus on eating healthy foods and staying active when you feel ready. Remember, it's important to be patient with yourself. If you have concerns about your weight or health, talking to a healthcare worker can provide support."
Nursing Tips for New Mothers,How can I make breastfeeding easier for both of us?,"To make breastfeeding easier, find a comfortable position that feels right for you and your baby. Ensure your baby latches on properly to avoid pain. Try to relax and enjoy the bonding time. If you face difficulties, don’t hesitate to ask for help from family or healthcare workers. Their support can make breastfeeding a positive experience for both you and your baby."
Postnatal Check-up Importance,Why is a check-up important after my baby is born?,A check-up after having your baby is important to ensure that you are healing well and to address any concerns you may have. It’s a good time to talk about your physical and emotional health. Your healthcare worker can provide advice on caring for your newborn and your body. Make sure to attend this appointment as it helps you stay healthy and ready for motherhood.
Healthy Eating During Pregnancy,What should I eat during pregnancy to keep me and my baby healthy?,"During pregnancy, it’s important to eat a variety of foods to stay strong and help your baby grow. Include more fruits, vegetables, whole grains, and proteins like lentils, beans, and eggs in your meals. Try to drink plenty of water and limit junk food. Eating healthy will give you energy and help your baby develop well. Share meals with your family to encourage healthy eating together."
Signs of Labor,How will I know when I am going into labor?,"You will know you are going into labor when you start feeling regular pains in your belly that get stronger and closer together. You might also notice a change in the discharge from your body or feel pressure in your lower back. If these signs happen, it’s time to prepare for the baby’s arrival. Make sure to have your bag ready and talk to your family about when to go to the hospital."
Postpartum Recovery,How can I take care of myself after having a baby?,"After having a baby, it’s important to rest and take care of yourself. Make sure to eat healthy foods and drink enough water. Ask for help from your family with household tasks and caring for the baby so you can recover. Take short walks to help your body heal, and don’t hesitate to talk about your feelings with someone you trust. Your health is important for you and your baby."
Contraception Options,What are some ways to prevent pregnancy after having a baby?,"After having a baby, there are different ways to prevent getting pregnant again. You can use methods like condoms, birth control pills, or long-term options like an injection or a small device placed in your body by a doctor. It's important to talk with your husband and a healthcare worker to find the best choice for you. Make sure to discuss this before you start having sex again."
Family Support During Pregnancy,How can my family help me during my pregnancy?,"Your family can support you during pregnancy in many ways. They can help with household chores, cook healthy meals, and encourage you to rest. Talk to them about your needs and feelings. Having their support can make you feel more relaxed and happy. Also, involve them in your prenatal check-ups if possible, so they understand your journey better."
Managing Stress During Pregnancy,What can I do to feel less stressed while pregnant?,"To feel less stressed during pregnancy, try to take time for yourself every day. You can practice deep breathing, listen to calming music, or take short walks outside. Talking to your family or friends about your feelings can also help. Remember, it’s okay to ask for help when you need it. Keeping a positive mindset is important for both you and your baby."
Importance of Rest During Pregnancy,Why is it important to rest during pregnancy?,"Resting during pregnancy is very important because your body is working hard to grow your baby. When you rest, you help your body recover and stay strong. Try to take short naps during the day and sleep well at night. If you feel tired, listen to your body and take breaks. This will help you feel better and be ready for the baby when they arrive."
Handling Nausea,What can I do to feel better if I have nausea during pregnancy?,"If you feel nausea during pregnancy, try eating small meals throughout the day instead of big ones. Foods like crackers or ginger tea can help settle your stomach. Drinking plenty of water is also important. Avoid strong smells that make you feel worse. If nausea continues, talk to a healthcare worker for more advice on how to feel better."
Signs of a Healthy Pregnancy,What signs show that my pregnancy is going well?,"Signs that your pregnancy is going well include feeling your baby move, having regular check-ups with your healthcare worker, and feeling generally healthy. You might also notice your belly growing as your baby develops. If you have any worries or feel unwell, it’s important to talk to someone who can help. Keeping in touch with your family and healthcare worker is key."
Understanding Baby Movements,When should I start feeling my baby move?,"Most women start feeling their baby move between 18 to 25 weeks of pregnancy. At first, the movements may feel like gentle flutters. As the baby grows, the movements will become stronger. If you notice a change in how often your baby moves, it’s good to talk to your healthcare worker. Feeling your baby move is a sign they are doing well."
Preparing for Delivery,What should I pack for the hospital when I go to deliver my baby?,"When packing for the hospital, include comfortable clothes for yourself, toiletries, and any personal items you may need. Don’t forget to pack a blanket and clothes for your baby, as well as snacks for your family. It’s also helpful to have a phone charger and any important documents. Make sure your bag is ready ahead of time so you won’t feel rushed when the time comes."
Understanding Baby's Needs,How do I know what my baby needs after birth?,"After birth, your baby will show you what they need through crying and movements. They may cry when they are hungry, tired, or need a diaper change. Pay attention to their sounds and body language. Over time, you will learn to understand their needs better. Don't hesitate to ask your family for help as you adjust to caring for your new baby."
Dealing with Family Expectations,How can I handle my family’s expectations about my pregnancy?,"It’s common for families to have expectations during pregnancy. To handle this, communicate openly with your family about your feelings and needs. Share your thoughts on what you want for your pregnancy and baby. Try to involve them in your journey, but remember that your health and happiness are most important. Setting boundaries is okay if you feel overwhelmed."
Understanding Baby's Sleep Patterns,How much sleep does my newborn need?,"Newborns usually sleep a lot, around 16 to 20 hours a day, but they wake up often to eat. Their sleep patterns will change as they grow. It’s important to create a calm sleeping environment for your baby. Try to follow their cues and let them sleep when they are tired. This will help them develop healthy sleep habits as they grow older."
Importance of Family Planning,Why is family planning important after having a baby?,"Family planning is important after having a baby because it helps you decide when you want to have more children. This can give you time to recover and bond with your newborn. It also allows you to plan for your family’s needs, like finances and support. Discussing family planning with your husband and a healthcare worker can help you make informed choices."
Managing Physical Changes,What physical changes can I expect during pregnancy?,"During pregnancy, your body will go through many changes. You may notice your belly growing, your breasts becoming larger, and your skin changing. Some women also experience swelling in their feet or feel more tired than usual. These changes are normal and show that your body is preparing for the baby. If you have concerns, don’t hesitate to ask your healthcare worker for advice."
Home Remedies for Pregnancy Discomfort,What home remedies can help with common discomforts during pregnancy?,"For common discomforts during pregnancy, you can try some simple home remedies. For nausea, ginger tea or eating small snacks can help. If you have back pain, gentle stretching or warm compresses may provide relief. Always rest when you feel tired. If discomfort continues, talk to your healthcare worker for more advice. Taking care of yourself is important for you and your baby."
Understanding Postpartum Care,What should I do for my health after having a baby?,"After having a baby, it’s important to take care of your health. Focus on eating healthy foods, drinking plenty of water, and getting enough rest. Allow yourself time to heal and don’t rush into activities. Talk to your healthcare worker about any concerns you have. Also, seek support from your family to help you manage your new responsibilities and take care of yourself."
Managing Expectations of Family,How can I manage my family’s expectations about my baby’s care?,"To manage your family’s expectations about your baby’s care, communicate openly with them. Share your thoughts on how you want to care for your baby and ask for their support. It’s okay to set boundaries if you feel overwhelmed. Involve them in caring for the baby when possible, but remember that you are the parent and know what is best for your child."
Recognizing Warning Signs,What warning signs should I look for during pregnancy?,"During pregnancy, watch for warning signs like severe pain in your belly, heavy bleeding, or sudden swelling in your hands and face. If you have a headache that doesn’t go away or feel very dizzy, it’s important to seek help. Trust your instincts; if something doesn’t feel right, contact your healthcare worker right away. Your health and your baby’s health are the top priority."
Understanding the Role of ASHA Workers,How can ASHA workers help me during my pregnancy?,"ASHA workers play a vital role in supporting pregnant women. They can provide information about healthy practices, help you get to check-ups, and offer advice on nutrition and care. They are also there to listen to your concerns and connect you with healthcare services. Don’t hesitate to reach out to them for guidance during your pregnancy journey."
Pregnancy Nutrition,What should I eat during pregnancy to keep myself and my baby healthy?,"During pregnancy, it is important to eat a variety of foods to stay healthy. Focus on eating more fruits, vegetables, whole grains, and proteins like beans, lentils, and eggs. Dairy products like milk and yogurt are also good for strong bones. Try to avoid junk food and sugary drinks. Eating small, healthy meals throughout the day can help keep your energy up and support your baby's growth."
Signs of Labor,How will I know when it’s time to go to the hospital for delivery?,"You will know it's time to go to the hospital when you start feeling strong pains in your belly that come and go regularly, or if your water breaks, which feels like a big gush of fluid. Other signs include feeling pressure in your lower back or pelvis. If you are unsure, it’s always best to call your doctor or midwife for advice. They can help you decide when to go."
