Theme,Questions,Answer
Postnatal Care for New Mothers,What should I focus on for my health after giving birth?,"After giving birth, focus on resting, eating healthy foods, and staying hydrated. It’s important to take care of your emotional health, too. Talk to family or friends when you feel overwhelmed. Keep your follow-up appointments with your healthcare worker to ensure you’re healing well physically and emotionally."
Signs of Possible Complications,What signs should I watch for that could mean complications during pregnancy?,"Watch for signs like severe abdominal pain, heavy bleeding, severe headaches, or vision changes. If you feel very dizzy or your baby is moving less than usual, contact your healthcare worker right away. It’s important to seek help if you notice these symptoms to keep you and your baby safe."
Understanding Labor Pain,What does labor pain feel like and how can I cope with it?,"Labor pain often feels like strong cramps or pressure in your belly and lower back. You can cope by breathing deeply, using relaxation techniques, or moving around. Having someone with you for support can help. Discuss pain relief options with your doctor ahead of time, so you’re prepared when labor begins."
Benefits of Skin-to-Skin Contact,What is skin-to-skin contact and why is it important for my baby?,"Skin-to-skin contact means holding your baby against your bare chest. This helps your baby feel safe and can improve bonding. It also helps with breastfeeding and keeps your baby warm. Try to do this right after birth and regularly afterward, as it is very beneficial for both you and your baby."
Understanding Baby's Sleep Patterns,How much sleep does my newborn need?,"Newborns typically sleep about 16-18 hours a day, but not all at once. They wake up often to eat. It’s important to create a safe sleep environment for your baby. Always place them on their back to sleep and avoid soft bedding. If you're worried about their sleep, consult your healthcare worker for advice."
Signs of Postpartum Depression,What should I know about postpartum depression?,"Postpartum depression is more than just feeling sad; it can include feeling very anxious, overwhelmed, or having trouble bonding with your baby. If you feel this way for more than two weeks, talk to your healthcare worker. They can help you find support and treatment to feel better."
Managing Weight Gain During Pregnancy,How can I manage my weight gain during pregnancy?,"Gaining some weight during pregnancy is normal, but you can manage it by eating healthy foods like fruits, vegetables, and whole grains. Avoid sugary snacks and focus on portion sizes. Regular light exercise is also good. Always check with your doctor about what is healthy for you and your baby."
Preparing for Baby's Arrival,What should I do to prepare for my baby's arrival?,"To prepare for your baby’s arrival, organize a safe sleeping area, gather baby clothes, diapers, and other essentials. Learn about newborn care, breastfeeding, and feeding schedules. Make a plan for who will help you after birth. It’s also helpful to have a list of contacts for healthcare support when needed."
Dealing with Fatigue During Pregnancy,What can I do to manage fatigue while pregnant?,"Fatigue is common during pregnancy. To manage it, try to rest whenever you can, take short naps, and ask for help with household tasks. Eating small, nutritious meals can help keep your energy up. Stay active with light exercise, but listen to your body and don’t overdo it."
Understanding Your Menstrual Cycle,How does pregnancy affect my menstrual cycle?,"During pregnancy, your menstrual cycle stops. This is because your body is focused on supporting the baby. After childbirth, your cycle may take time to return, especially if you are breastfeeding. It’s normal for periods to be irregular initially, but if you have concerns, consult your healthcare worker."
When to Seek Help During Pregnancy,When should I call my doctor during pregnancy?,"Call your doctor if you experience severe pain, heavy bleeding, or if your baby is not moving as much as usual. If you have severe headaches, vision changes, or signs of swelling in your hands or face, seek help. It’s always better to ask if you’re worried about anything during your pregnancy."
Dealing with Morning Sickness,What can I do to ease morning sickness during my pregnancy?,"Morning sickness can be troubling, but there are ways to feel better. Try eating small, simple meals throughout the day. Ginger tea or small sips of cold drinks might help. Avoid strong smells and spicy foods. Getting fresh air can also be beneficial. If nausea is severe, talk to your doctor for advice."
Signs of Labor,What signs should I look for to know if I am going into labor?,"Signs of labor include regular contractions that get stronger and closer together, lower back pain, and a feeling of pressure in your pelvis. You might also notice a change in vaginal discharge or your water breaking. If you see these signs, it's time to go to the hospital or call your healthcare worker."
Importance of Antenatal Visits,Why is it important to attend antenatal check-ups during pregnancy?,"Antenatal check-ups are very important for a healthy pregnancy. They help ensure you and your baby are doing well. Your doctor checks your health, the baby's growth, and gives you advice on nutrition and care. Regular visits can catch any problems early so they can be treated. Aim for at least 4 visits during your pregnancy."
Nutrition for Breastfeeding Mothers,What should I eat while breastfeeding to keep my baby healthy?,"While breastfeeding, eat a balanced diet that includes fruits, vegetables, whole grains, and protein. Foods like lentils, milk, eggs, and lean meat are good. Drink plenty of water to stay hydrated. Try to avoid junk food and very spicy meals as they may upset your baby’s stomach. A healthy diet helps produce good milk."
Timing for Introducing Solid Foods,When should I start giving solid foods to my baby?,"You can start introducing solid foods to your baby around 6 months old. Begin with soft, mashed foods like rice, lentils, or fruits. Avoid salt and sugar at first. Watch for signs that your baby is ready, such as sitting up with support and showing interest in food. Continue breastfeeding alongside solid foods for better nutrition."
Managing Anemia in Pregnancy,How can I manage anemia during my pregnancy?,"Managing anemia during pregnancy is important for your health and your baby's. Eat iron-rich foods like spinach, lentils, and meat. Combining these with vitamin C foods like oranges can help iron absorption. Take any iron supplements your doctor recommends. Also, avoid tea or coffee during meals, as they can block iron absorption."
Safe Physical Activity in Pregnancy,What types of physical activity are safe during pregnancy?,"Gentle activities like walking, swimming, or prenatal yoga are great during pregnancy. They can help you stay fit and reduce stress. Avoid heavy lifting and high-impact exercises. Always listen to your body and rest when needed. If you have health concerns, talk to your doctor about what is safe for you."
Recognizing Pregnancy Symptoms,What early signs should I look for to know if I am pregnant?,"Early signs of pregnancy can include missed periods, nausea, tiredness, and frequent urination. You might also feel breast tenderness or mood swings. If you notice these signs, consider taking a pregnancy test. If positive, contact a healthcare worker for guidance on your next steps."
Infection Prevention in Newborns,How can I protect my newborn from infections?,"To protect your newborn, wash your hands before holding them and keep them away from sick people. Breastfeeding provides important antibodies that help fight infections. Keep their living area clean and avoid crowds. Ensure your newborn has regular check-ups to stay healthy. Skin-to-skin contact also helps strengthen their immunity."
Postnatal Exercise Recommendations,When can I start exercising after giving birth?,"You can start light exercises like walking soon after birth, usually within a few days. But wait at least 6-8 weeks before doing more strenuous activities, especially if you had a cesarean section. Always listen to your body and consult your doctor before starting any new exercise program to ensure it’s safe for you."
Safe Sex After Childbirth,When can I have sex after giving birth?,"It's best to wait about 6 weeks after giving birth before having sex. This gives your body time to heal. If you had any tears or stitches, make sure to get your doctor's approval first. Use protection to prevent infections and discuss family planning options with your partner during this time."
Understanding Miscarriage,"What is a miscarriage, and what signs should I be aware of?","A miscarriage is when a pregnancy ends early, usually before 12 weeks. Signs can include bleeding, cramping, or fluid passing from the vagina. If you notice these symptoms, contact your doctor immediately. They can provide support and help you understand what might be happening."
Postpartum Care Essentials,What should I focus on for my health after childbirth?,"After childbirth, focus on resting, eating healthy foods, and staying hydrated. Pay attention to your own needs as well as your baby's. Keep track of any changes in your body and don't hesitate to ask for help. Regular check-ups are also important to ensure your recovery is on track."
Signs of Breastfeeding Difficulties,How can I tell if I am having trouble breastfeeding?,"Signs of breastfeeding difficulties include your baby not latching well, not gaining weight, or you feeling pain while breastfeeding. If you notice any of these signs, seek help from a healthcare worker or lactation consultant. They can provide support and advice to help you and your baby succeed."
Managing Stress During Pregnancy,What are effective ways to manage stress during pregnancy?,"To manage stress during pregnancy, try to practice relaxation techniques like deep breathing or meditation. Engaging in gentle exercise, talking to friends or family, and spending time in nature can also help. Make sure to get enough rest and don’t hesitate to speak with a healthcare worker if your stress feels overwhelming."
Coping with Fatigue Postpartum,What can I do to cope with fatigue after having a baby?,"Coping with fatigue after childbirth is common. Try to rest or sleep when your baby sleeps. Ask for help from family and friends to share childcare. Eating nutritious foods and staying hydrated can boost your energy. Remember, it's okay to take breaks and care for yourself during this busy time."
Understanding Baby's Sleep Patterns,What are normal sleep patterns for a newborn?,"Newborns typically sleep 16-18 hours a day, waking every 2-3 hours to eat. Their sleep is usually in short periods. Don't worry if they wake up often; this is normal. Create a soothing environment for sleep and try to establish a bedtime routine as they get older."
Preparing for Pregnancy,What steps can I take to prepare my body for pregnancy?,"To prepare for pregnancy, start by eating healthy foods like fruits, vegetables, and whole grains. Try to maintain a healthy weight and stay active with light exercises. It’s also good to check with a healthcare worker to see if you need any extra vitamins. Reducing stress and avoiding smoking or drinking alcohol will help your body be ready for a baby."
Understanding Pregnancy Symptoms,What are common signs that I might be pregnant?,"Common signs of pregnancy include missing your monthly cycle, feeling more tired than usual, having tender breasts, or feeling sick in the morning. Some women also notice mood swings. If you think you might be pregnant, taking a special test or visiting a healthcare worker can help confirm it."
Managing Fatigue During Pregnancy,What can I do to cope with tiredness while pregnant?,"Feeling tired is normal during pregnancy. To help, try to rest whenever you can and take small naps. Eating healthy foods and staying hydrated can give you more energy. Gentle exercises like walking can also help you feel better. If you still feel overly tired, talk to a healthcare worker for advice."
Feeling Unwell During Pregnancy,What should I do if I feel sick during my pregnancy?,"If you feel sick, try to eat small, easy-to-digest meals, like crackers or boiled potatoes. Drinking ginger tea or sucking on ginger candies may also help. Stay hydrated with water. If the sickness is very bad or lasts a long time, it’s best to talk to a healthcare worker for more help."
Nutritional Needs in Pregnancy,What foods should I eat to stay healthy while pregnant?,"While pregnant, eat a variety of foods. Focus on fruits, vegetables, whole grains, and proteins like lentils, beans, and chicken. Dairy products like yogurt or milk are also good for you. These foods help your baby grow strong. Try to avoid junk foods and sugary drinks as much as possible."
Safe Exercise During Pregnancy,What kind of exercise is safe for me during pregnancy?,"Light exercises like walking, swimming, or gentle yoga are safe and helpful during pregnancy. These activities can improve your mood and keep your body strong. Always listen to your body; if you feel pain or discomfort, stop and rest. It’s good to talk to a healthcare worker about what exercises are best for you."
Preparing for Labor,How can I prepare my mind for childbirth?,"Preparing for childbirth can be scary, but staying calm helps. Learn about the process by talking to other mothers or attending classes. Breathing exercises and relaxation techniques can also ease your mind. Surround yourself with supportive family members and friends who can help you during this time."
Post-Birth Recovery,What should I expect during my recovery after giving birth?,"After giving birth, it’s normal to feel tired and have some discomfort. Your body needs time to heal, so it’s important to rest whenever possible. You might also experience mood swings. Talk to your family for support, and if you have concerns, don’t hesitate to reach out to a healthcare worker."
Breastfeeding Basics,How can I make breastfeeding easier for me and my baby?,"To make breastfeeding easier, try to find a comfortable position and hold your baby close. Skin-to-skin contact can help both you and your baby feel relaxed. Offer your breast whenever your baby shows hunger signs. If you have any difficulties, seek help from a healthcare worker or a lactation expert."
Newborn Care Basics,How can I soothe my newborn when they cry?,"If your newborn cries, first check if they are hungry or need a diaper change. You can also try holding them close, rocking gently, or singing softly. Swaddling them in a soft blanket can help them feel secure. Sometimes, a warm bath or a change of scenery can calm them down too."
Signs of Illness in Babies,What signs should I look for to know if my baby is unwell?,"Watch for signs like a high fever, not eating or drinking well, or being unusually sleepy. If your baby is crying more than usual and seems uncomfortable, it may be a sign of trouble. If you notice anything unusual or are worried, don’t hesitate to consult a healthcare worker."
Providing for Your Baby,How can I ensure my baby is getting enough milk?,"You can tell if your baby is getting enough milk if they are feeding well and have wet diapers regularly. After feeding, if your baby seems satisfied and sleepy, that's a good sign. If you have concerns about your milk supply or your baby’s feeding, talk to a healthcare worker for guidance."
Introducing Solid Foods,When can I start giving my baby solid foods?,"You can start giving your baby solid foods around 6 months old, but always talk to a healthcare worker first. Begin with mashed fruits or vegetables, and introduce one new food at a time. Watch closely for any reactions. This way, you can help your baby enjoy healthy eating."
Dealing with Mood Swings,What can I do about my mood swings after giving birth?,"Feeling different emotions after giving birth is normal. Talk to friends or family about how you feel; it helps a lot. Remember to take time for yourself, even if it’s just a few quiet moments. If your feelings don’t improve or worsen, it’s important to talk to a healthcare worker for support."
Planning Future Pregnancies,How can I space my pregnancies for better health?,"It’s best to wait at least a couple of years before having another baby. This gives your body time to heal and be strong again. Talk to your healthcare worker about family planning, and make sure to discuss any concerns. They can help you choose the right methods for spacing your children."
Understanding Your Body After Childbirth,What changes can I expect in my body after giving birth?,"After giving birth, it’s normal to notice changes like weight fluctuation, changes in your belly, and sometimes hair loss. Your monthly cycle may also take time to return. These changes are part of healing. If you have concerns, don’t be afraid to reach out to a healthcare worker for advice and support."
Managing Household Responsibilities,How can I balance baby care with household chores?,"Balancing baby care with chores can be tough. Try to ask family members for help, and prioritize tasks. Do small chores when your baby sleeps or plays. It’s okay to let some things wait; your health and the baby’s care are most important. Remember, taking breaks is also essential for you."
Seeking Support,How can I find support during motherhood?,Finding support is essential. Connect with your family and friends to share your experiences. You can also join local mothers' groups or talk to healthcare workers who can provide guidance. Sometimes sharing your feelings with others who understand can make a big difference in your journey as a mother.
Vaccinations for Babies,Why are vaccinations important for my baby?,"Vaccinations protect your baby from serious illnesses and help keep them healthy. They prepare your baby’s body to fight diseases. Talk to your healthcare worker about the vaccination schedule, and make sure your baby gets all the shots on time for their health and safety."
Self-Care for Mothers,"What is self-care, and why is it important for me as a mother?","Self-care means taking time for yourself to relax and recharge. It’s important because it helps you feel better mentally and physically, allowing you to care for your baby more effectively. Simple things like reading, taking a warm bath, or enjoying a quiet time can help you feel refreshed. Don’t forget to ask for help when needed!"
Building a Routine,How can I create a daily routine for my baby?,"Creating a daily routine can help your baby feel secure and know what to expect. Try to set regular times for feeding, naps, and play. Keep the routine flexible to adapt to your baby’s needs. Over time, this helps you both feel more organized and relaxed."
First-time Parenting Tips,What are some tips for new mothers to feel more confident?,"As a new mother, remember it’s okay to ask for help and advice from family and friends. Trust your instincts; you know your baby best. Take time to learn and enjoy these moments. Keep calm in challenging situations, and know that it’s a learning process for both you and your baby."
Coping with Loss of Sleep,How can I cope with lack of sleep as a new mother?,"Lack of sleep is common for new mothers. Try to rest when your baby sleeps and share night duties with your partner or family members. Take short naps during the day. Staying hydrated and eating well can also help you feel more awake. If you feel too tired, talk to a healthcare worker for advice."
Understanding Baby's Development,How can I help my baby develop their skills?,"Helping your baby develop skills is fun! Talk and sing to them often, and play simple games like peek-a-boo. Offer them colorful toys to look at or reach for. Encourage tummy time to help strengthen their muscles. Each small interaction encourages their growth and learning in a loving way."
Adjusting to Motherhood,How can I adjust to my new role as a mother?,"Adjusting to motherhood takes time, so be patient with yourself. Surround yourself with supportive family and friends who can help you. Take things one day at a time and find joy in small moments with your baby. Remember, it’s normal to feel a mix of emotions as you adapt to this new journey."
Planning for Pregnancy,What steps should I take when planning to get pregnant?,"When planning for a baby, start by eating healthy foods like fruits, vegetables, and grains. Make sure to stay active with light exercises and avoid stress. It’s also important to visit a health worker for advice and check if you need any special vitamins. Talk openly with your husband about your plans and support each other. Keeping a positive mind can also help."
Healthy Snacking During Pregnancy,What are some healthy snacks to have during pregnancy?,"Eating healthy snacks during pregnancy is great for you and your baby. Choose foods like fresh fruits, nuts, yogurt, or roasted seeds. You can also enjoy whole-grain crackers with cheese or a glass of milk. These snacks offer energy and nutrients. Avoid junk food like chips and sweets, as they are not good for your health."
Hydration in Pregnancy,How much water should I drink while pregnant?,"It's important to drink enough water during pregnancy to keep yourself and your baby healthy. Aim for about 8-10 glasses of water each day. You can also drink coconut water or fresh juice for variety. Staying hydrated helps prevent tiredness and swelling. If you feel thirsty, drink more, especially in hot weather."
Preparing for Labor,How can I prepare for the day I go into labor?,"Preparing for labor involves packing a small bag with essentials like clothing, toiletries, and snacks. Create a plan with your husband about how to reach the hospital when it's time. Practice relaxation techniques like deep breathing or listening to soothing music to help you stay calm. Discuss your wishes for labor with your health worker ahead of time."
Signs of Labor,What signs should I look for that indicate labor is starting?,"You may notice a few signs that labor is near, like regular tummy tightenings, losing a bit of a jelly-like fluid, or a feeling of pressure in your back or lower belly. If you feel your water break, it’s important to go to the hospital. Stay in touch with your health worker to discuss your feelings and any changes you notice."
Prenatal Care Importance,Why is it important to visit the doctor during pregnancy?,"Visiting the doctor during pregnancy is very important to keep you and your baby healthy. Regular check-ups help to ensure that your baby is growing well and that you are feeling good. The doctor can give you advice on food, vitamins, and what to expect. Early visits can catch any problems before they become serious. Share all your questions with the doctor during these visits."
Healthy Weight During Pregnancy,How can I maintain a healthy weight while pregnant?,"To keep a healthy weight during pregnancy, focus on eating a variety of home-cooked foods like grains, pulses, and vegetables. Avoid too many oily or sugary snacks. Try to stay active by walking or doing simple exercises. Drink plenty of water and listen to your body's hunger signals. If you have any concerns about your weight, talk to your healthcare worker for guidance."
Preparing for Labor,What should I pack for the hospital when I go into labor?,"When preparing for the hospital, pack a bag with essentials. Include clothes for yourself, personal hygiene items, and comfy shoes. Don't forget to pack things for the baby like clothes and blankets. Bring snacks for your partner and any documents like identification and health records. Having a support person with you can also make the experience smoother."
Signs of Labor,How will I know when it’s time to go to the hospital to give birth?,"You will know it’s time to go to the hospital when you start having regular, strong pains in your lower belly or back. You might see a change in your body’s mucus, and you may gush fluid or have a ""show."" If you feel nervous or unsure, it’s always best to call your doctor for advice. Trust your instincts, and don’t hesitate to ask for support."
Breastfeeding Benefits,Why should I consider breastfeeding my baby?,"Breastfeeding is very good for your baby because it gives them the perfect food for growth. It helps protect them from illness and makes them strong. It can also help you feel closer to your baby and save money. If you have trouble, don’t worry—ask a family member or healthcare worker for help and support to make it easier."
Post-Birth Recovery Tips,How can I take care of myself after giving birth?,"After giving birth, it's important to rest as much as possible. Drink plenty of water and eat nutritious foods to help your body heal. Take time to bond with your baby, but also ask family for help when you need it. Gentle walks can help you feel better too. If you feel very tired or sad, talk to someone about how you feel."
Understanding Baby's Sleep Patterns,"How much sleep does my newborn need, and when should I expect them to sleep longer?","Newborns usually sleep a lot, around 16-18 hours a day, but often wake up to feed. As your baby grows, around 3-4 months, they may start sleeping longer at night. Create a quiet bedtime routine, and it will help your baby learn when to sleep. If you have concerns, speak with a health worker for advice and support."
