Theme,Questions,Answer
Recognizing Baby's Cues,"What are the signs that my baby needs something, like food or comfort?","Babies show they need something by crying, fussing, or turning their head. They may also put their hands to their mouth or make sucking noises. If your baby seems restless or looks at you with wide eyes, they might need your attention, comfort, or food. Responding to these cues helps your baby feel loved and secure."
Healthy Eating After Birth,What should I eat after giving birth to help with recovery and breastfeeding?,"After giving birth, focus on eating healthy foods that help you recover and produce good milk. Include fruits, vegetables, whole grains, and proteins like lentils and chicken in your meals. Stay hydrated by drinking plenty of water. Eating wholesome food not only helps you heal but also provides the best nutrition for your baby."
Family Support in Parenting,How can my family help me after I have a baby?,"Your family can help a lot after you have a baby by providing support and assistance. They can help with household chores, cooking, or even looking after the baby while you rest. Emotional support is also very important; talking to family members about your feelings can help you feel less alone. Always share your needs with them."
Vaccination Awareness,"Why do babies need vaccinations, and when should they get them?","Vaccinations are important because they help protect your baby from serious illnesses. They work by teaching your baby's body how to fight germs. Your baby will need to get vaccinations at certain times, usually starting right after birth. Keep track of the dates and talk to your doctor about what your baby needs to stay healthy."
Nutrition During Breastfeeding,What should I eat to ensure I produce enough milk while breastfeeding?,"To produce enough milk while breastfeeding, eat a balanced diet with lots of fruits, vegetables, whole grains, and proteins like eggs, fish, and beans. Drink plenty of water and try to relax. Foods like oats and nuts can also help. Eating well ensures you and your baby get the nutrients you need for health and energy."
Importance of Family in Decision-Making,How can my family influence decisions about my pregnancy and baby care?,"Family often plays a big role in your decisions about pregnancy and caring for your baby. They can provide advice, help with daily tasks, and offer emotional support. It's common for families to share beliefs and traditions about health and child-rearing. Always communicate openly with your family about your needs and preferences to find the best approach together."
Physical Activity After Birth,"Can I start exercising after giving birth, and when is it safe?","After giving birth, it’s good to stay active, but start gently. You can begin with short walks when you feel ready. Most women can start light exercises around 6 weeks after birth, but always listen to your body. If anything feels painful or uncomfortable, stop and consult with your healthcare worker for advice on when to safely increase activity."
Managing Older Children's Needs,How can I balance my time between a newborn and my older child?,"Balancing time between a newborn and older child can be challenging, but it’s possible. Include your older child in caring for the baby—let them help with little tasks. Create special time for just your older child, like reading together or playing games. Encourage family members to support you, allowing you to manage both children's needs better."
Signs of Good Baby Health,How can I tell if my baby is healthy and growing well?,"You can tell if your baby is healthy by checking their growth and behavior. If they are feeding well, gaining weight, and have plenty of wet diapers, that’s a good sign. A healthy baby will also be alert and respond to sounds. Regular check-ups with the doctor will help ensure your baby is on the right track. Keep asking questions if you have concerns."
Home Remedies for Baby's Common Issues,What are some safe home remedies for my baby’s common problems like colds or tummy aches?,"For mild baby cold symptoms, keep your baby’s room good with fresh air, and a warm bath can soothe them. For tummy aches, gentle tummy massages or holding them upright can help. Always ask your healthcare worker before trying any home remedies to ensure they are safe for your baby’s age and condition."
Understanding Baby's Growth Milestones,What should I expect in my baby's growth during the first few months?,"In the first few months, your baby will grow quickly. They may start to lift their head, smile, and make sounds. By three months, they might be able to push up when lying on their tummy. Every baby is different, so celebrate their unique milestones! If you have concerns about their growth, check in with your healthcare worker."
Understanding Contraception Options,What are some safe ways to space out my children after having a baby?,"After having a baby, it’s important to think about when you want to have more children. You can discuss family planning options with a healthcare worker. Some methods include natural planning based on your cycle or using simple medicines or devices that prevent pregnancy. Choose what feels right for you and your family’s needs, and seek support from trusted people."
Recognizing Urgent Health Signs,What urgent signs should I look for after childbirth that need immediate attention?,"After childbirth, watch for heavy bleeding, severe pain, or fever. If you feel very weak or dizzy, it’s important to get help quickly. Also, if you have trouble breathing or feel very sad for a long time, contact a healthcare worker right away. Staying alert to these signs helps keep you safe and healthy."
Navigating Healthcare Support,How can I find good healthcare support during my pregnancy and after having a baby?,Finding good healthcare support starts with talking to family members or friends for recommendations. You can also visit local clinics or hospitals to meet healthcare workers. Regular visits to your doctor and community health worker can ensure you receive the right care during pregnancy and after birth. Always feel free to ask questions when you visit them.
Planning for Pregnancy and Health,What should I do to prepare my body for a healthy pregnancy?,"To prepare for a healthy pregnancy, focus on eating balanced meals with fruits, vegetables, and grains. Drink plenty of water and try to stay active with light exercises like walking. It's important to get regular check-ups and talk to your healthcare worker about taking vitamins that can help you. Also, avoid smoking and alcohol to keep your body ready for the baby."
Breastfeeding and Milk Production,How can I ensure I have enough milk while breastfeeding my baby?,"To help make enough milk for your baby, breastfeed often, at least every 2-3 hours. Drink plenty of water and eat well, including foods like dal, vegetables, and whole grains. Rest when you can, and relax while feeding. If you feel worried about not having enough milk, talk to a healthcare worker for support."
Signs of Healthy Pregnancy,What signs show that my pregnancy is going well?,"Healthy signs of pregnancy include feeling your baby move, maintaining a good appetite, and having regular check-ups with your healthcare worker. It’s also normal to feel some tiredness or mood changes. Always share any concerns with your healthcare worker during visits to ensure both you and the baby are healthy."
Nutrition and Weight Gain During Pregnancy,"How much weight should I gain during pregnancy, and how can I do it healthily?","Gaining weight is normal during pregnancy. Focus on eating healthy foods like lentils, whole grains, and fresh vegetables. Aim to gain around 10-15 kg, but listen to your body. Avoid junk food and sugary drinks. Regular check-ups will help you and your doctor track your progress."
Handling Pregnancy Discomfort,What can I do about the nausea I feel during pregnancy?,"To reduce nausea, try eating small meals throughout the day instead of large ones. Ginger tea or dry crackers can also help soothe your stomach. Drink plenty of water and avoid strong smells and greasy foods. If nausea is severe and doesn't get better, consult your healthcare worker for advice."
Coping with Stress During Pregnancy,How can I manage stress while I am pregnant?,"Managing stress is important during pregnancy. You can try deep breathing, talking to your family, or taking short walks to relax. Enjoy quiet time or listen to gentle music. Sharing your feelings with loved ones can also help. Always remember, it's okay to ask for support when you need it."
Postpartum Recovery and Rest,How can I recover after giving birth and take care of myself?,"After giving birth, it's important to rest as much as possible. Eat nutritious foods, like fruits and cooked vegetables, to help heal your body. Keep yourself hydrated by drinking water. Share household chores with family members, and don’t hesitate to ask for help. If you feel pain or sadness for a long time, speak to a healthcare worker."
Family Support During Pregnancy,How can my family help me during my pregnancy?,"Your family can help you by providing emotional support and helping with daily tasks. Encourage them to cook healthy meals, take care of children, and share responsibilities at home. Having family members to talk to about your feelings can be comforting too. Always communicate your needs to them."
Choosing a Birth Location,"Where is the best place to give birth, and how should I choose?",Choosing where to give birth is important. Look for a nearby health center or hospital that is safe and has good care. You can ask family members about their experiences. Ensure that the place has trained staff to help you during delivery. Visit the location beforehand to feel comfortable with your choice.
Recognizing Warning Signs During Pregnancy,What warning signs should I watch for during my pregnancy?,"Watch for signs like severe belly pain, heavy bleeding, or sudden swelling in your hands or face. If you have a bad headache or feel like your baby is not moving much, contact your healthcare worker immediately. It’s important to know that your safety and the baby’s health are top priorities."
Understanding Your Body After Childbirth,What changes will my body go through after having a baby?,"After having a baby, your body will change in many ways. You may experience some swelling, bleeding, and changes to your breasts. Your tummy may take time to go back to its normal size. It’s also normal to feel different emotions. Take things slow and focus on caring for yourself and your baby."
Feeding and Baby's Weight Gain,How can I ensure my baby is gaining enough weight?,"To check if your baby is gaining enough weight, observe if they are feeding well and having enough wet diapers. A healthy baby should gain about 150-200 grams each week. Feed your baby whenever they show hunger signs. If you are worried about weight gain, see your healthcare worker for help."
Healthy Eating Postpartum,What should I eat after having my baby to stay healthy?,"After having your baby, eating healthy is very important. Focus on foods like lentils, fresh vegetables, and fruits to help your body recover and produce milk. Drink plenty of water and avoid junk food. Include healthy fats from nuts or oils in your meals for energy."
Family Dynamics and Decisions on Childbirth,How does my family influence my choices about childbirth?,"Your family can have a big impact on your childbirth choices. They might share their experiences and suggestions, which can be helpful. However, it’s important to also consider what you feel is right for you. Always communicate your preferences to your family, and try to find a balance between their advice and your comfort."
Preparing for Baby's Arrival,What should I do to get ready for my baby’s arrival?,"To prepare for your baby, set up a safe sleeping area and gather necessary items like clothes and diapers. Learn about feeding and caring for a newborn. Talk to family members who have experience to gain tips. Also, take time for yourself to rest and relax in the last weeks of your pregnancy."
Emotional Wellbeing After Giving Birth,How can I take care of my feelings after having a baby?,"After having a baby, it’s normal to feel many emotions. Talk to your family and friends about how you feel. Taking small breaks for yourself, even if just a few minutes, can help. Make sure to rest and, if you feel very sad or overwhelmed, reach out to a healthcare worker for support."
Managing Common Illnesses During Pregnancy,What should I do if I catch a cold during my pregnancy?,"If you catch a cold while pregnant, rest as much as possible and drink warm fluids like tea or soup. Use honey for a sore throat. Avoid taking any medicine without asking your healthcare worker first. If symptoms worsen or you have a high fever, seek medical attention to keep you and your baby safe."
Understanding Your Menstrual Cycle Postpartum,When will my cycle return after having a baby?,"After having a baby, your cycle may take time to return, especially if you are breastfeeding. It might take several months for your body to get back to its normal rhythm. Each woman is different, so if your cycle doesn’t return within a year, check in with your healthcare worker for advice."
Recognizing Signs of Dehydration,How can I tell if I am not drinking enough water after childbirth?,"Signs of not drinking enough water include feeling very thirsty, dark yellow urine, and feeling tired or dizzy. It’s important to drink more water, especially while breastfeeding. If you notice these signs, try to drink more fluids and talk to a healthcare worker if it doesn’t improve."
Contraception Options After Birth,What are my options for family planning after I have my baby?,"After having a baby, you can discuss family planning with your healthcare worker. There are several methods, like tablets or injections, that can help prevent pregnancy. You can also use natural methods, like tracking your cycle. It's important to choose a method that feels right for you and your family."
Newborn Care and Bathing,How should I give my newborn a bath safely?,"When bathing your newborn, use lukewarm water and keep the room warm. Use a small baby tub or basin. Always support your baby’s head and neck while bathing. Use gentle soap and wash gently. Keep bath time short and never leave your baby alone in the water. Wrap your baby in a towel right after to keep them warm."
Returning to Physical Activity,When can I start exercising after having my baby?,"It’s best to wait about 6-8 weeks after giving birth to start exercising, but listen to your body. Start with gentle activities like walking or stretching. Gradually, you can add more. Always talk to your healthcare worker before starting any new exercise routine to ensure it's safe for you."
Managing Morning Sickness,What can I do to ease the morning sickness I feel during pregnancy?,"Morning sickness can be tough, but there are ways to make it easier. Try eating small snacks like dry biscuits or toast before getting out of bed in the morning. Ginger tea and peppermint can also help calm your stomach. Stay hydrated by drinking water throughout the day. If it gets too bad, talk to your doctor for more help."
Understanding Weight Gain in Pregnancy,How much weight should I gain during my pregnancy?,"The amount of weight to gain during pregnancy can vary, but a common guideline is about 10 to 15 kilograms for most women. Your doctor can give specific advice based on your situation. It’s important to eat healthy foods and stay active when possible. Gaining too much or too little can affect your health and the baby’s health, so regular check-ups are good."
Choosing a Birth Location,Where is the best place for me to have my baby?,"Choosing where to have your baby is important. Many women prefer hospitals for safety and support. If you have a safe home or a well-equipped health center nearby, that's also an option. Discuss with your family and healthcare provider to make the best choice for you and your baby, considering where you feel most comfortable and safe."
Recognizing Warning Signs in Pregnancy,What signs during pregnancy should make me worry and seek help?,"There are a few signs during pregnancy that you should not ignore. If you have severe pain in your belly, heavy bleeding, or a sudden headache that won’t go away, seek help quickly. Also, if you feel very dizzy or see changes in your vision, it’s important to talk to a doctor right away to ensure everything is okay."
Dealing with Fatigue During Pregnancy,"Why do I feel so tired during my pregnancy, and what can I do about it?","Feeling tired is common during pregnancy because your body is working hard to support your baby. To help, try to rest when you can, take short naps, and eat balanced meals to keep your energy up. Gentle exercise like walking can also help you feel better. Make sure to ask your family for support during this time."
Cultural Beliefs Around Pregnancy,What cultural beliefs should I be aware of during my pregnancy?,Many cultures have special beliefs and practices during pregnancy. Some people believe in avoiding certain foods or performing rituals. It's important to listen to your family and community but also trust your own feelings and needs. Talk with your healthcare provider if you have questions about what is safe and healthy during this time.
Breastfeeding Challenges,What should I do if I have trouble breastfeeding my baby?,"If you have trouble breastfeeding, don’t worry—many mothers face challenges. It can help to try different positions or use a pillow for support. Make sure your baby is latching properly. If needed, ask for help from a healthcare provider or a supportive family member. Sometimes, small adjustments can make a big difference in your breastfeeding experience."
Introducing Solid Foods,When can I start giving solid foods to my baby?,"You can usually start giving solid foods to your baby around six months old. Begin with small, soft foods like mashed bananas, rice, or porridge. It’s a good idea to introduce one food at a time and watch for any reactions. Always make sure the food is safe and cooked properly. Enjoy this new stage with your baby!"
Managing Stress During Pregnancy,What can I do to manage stress while I’m pregnant?,"Managing stress is important for you and your baby. Try to take time for yourself by practicing relaxation techniques, such as deep breathing or gentle yoga. Spending time with loved ones, talking about your feelings, and taking walks can also help. Make sure to rest and do activities that make you happy."
Postpartum Recovery,What should I expect after giving birth?,"After giving birth, your body will go through many changes as it starts to heal. It’s normal to feel tired and emotional. You may have some discomfort and vaginal bleeding. Take care of yourself by resting, eating healthy foods, and asking for help from family and friends. If you feel very sad or overwhelmed, talk to someone you trust."
Signs of an Unhealthy Pregnancy,What are some signs that my pregnancy might be unhealthy?,"If you notice signs like heavy bleeding, severe pain in your belly, or a high fever, you should seek medical help immediately. Also, if you have trouble breathing or feel very weak and dizzy, call a doctor right away. It’s always better to be safe and check with a healthcare provider if you have any worries."
Nutrition in Pregnancy,What should I eat to stay healthy during my pregnancy?,"Eating a balanced diet is key during pregnancy. Include a variety of foods like whole grains, fresh fruits and vegetables, dairy, and proteins like beans or chicken. This will give you and your baby the nutrients you need. Try to avoid too much junk food and sugary drinks. Water is also very important, so drink plenty throughout the day."
Safe Exercise During Pregnancy,"Can I exercise while I’m pregnant, and what is safe to do?","Yes, you can exercise during pregnancy, and it’s good for your health. Gentle activities like walking, swimming, or prenatal yoga are usually safe. Avoid high-impact sports or heavy lifting. Always listen to your body and rest when needed. If you're unsure about any exercises, check with your doctor for guidance."
Understanding Your Baby's Development,How do I know if my baby is growing properly?,"To know if your baby is growing well, regular check-ups with a healthcare provider are important. They will measure your baby’s weight, length, and head size. You can also notice signs as your baby gets stronger and more active. If you have any concerns about their growth, don’t hesitate to ask your doctor."
Coping with Mood Swings,Why do I have mood swings during my pregnancy?,"Mood swings are common during pregnancy due to changes in hormones and stress. You might feel happy one moment and sad the next. This can be confusing, but it’s normal. Take care of yourself by talking to someone about your feelings, resting, and practicing relaxation. If your mood swings feel too much, talk to a healthcare provider."
Choosing a Contraceptive Method,What should I think about when choosing a way to prevent pregnancy after birth?,"When thinking about preventing pregnancy after giving birth, consider your health, your family's needs, and your future plans. There are many options like pills, injections, or devices. Talk with your healthcare provider to find what works best for you. It’s important to choose a method that you feel comfortable with and can manage."
Pain in Labor,What can I do to manage pain during labor?,"Managing pain during labor can involve several strategies. Breathing techniques, moving around, and using warm water can help ease discomfort. You can also ask for support from your partner or family during labor. If you feel you need more help, discuss options with your healthcare provider, as there are pain relief methods available."
Preparing Older Siblings for a New Baby,How can I help my older child prepare for the new baby?,Preparing your older child for a new baby can be fun. Talk about the baby and what their role will be. Include them in activities like setting up the baby’s room. Reading books about new siblings can also help them understand. Encourage them to share their feelings and reassure them they are still very loved.
Postpartum Body Changes,What changes can I expect in my body after having a baby?,"After having a baby, your body will go through many changes. You may notice changes in your belly shape, weight, and breast size. Some women experience skin changes as well. It’s important to remember that these changes are normal and part of your body healing. Take time to adjust, and seek support from friends or family if needed."
Understanding Your Baby’s Crying,"Why does my baby cry so much, and how can I help them?","Babies cry to communicate their needs, like hunger, discomfort, or tiredness. To help them, check if they need feeding, a diaper change, or cuddling. Sometimes, gentle rocking or singing can soothe them. It may take time to learn what your baby wants, so be patient and offer comfort when they cry."
Signs of Healthy Breastfeeding,How can I tell if my baby is feeding well?,"You can tell if your baby is feeding well by watching for signs like regular wet diapers and steady weight gain. Your baby should appear satisfied after feeds and have a good latch. If you are unsure, don’t hesitate to ask a healthcare provider or a lactation consultant for guidance and support."
Nutritional Needs During Pregnancy,What foods should I eat to stay healthy during my pregnancy?,"Eating a variety of foods is important during pregnancy. Focus on whole grains, fruits, and vegetables, as they provide essential nutrients. Including beans, lentils, nuts, and dairy can also be beneficial. Try to drink plenty of water and eat smaller meals throughout the day. If you have specific cravings or food concerns, please talk to your doctor for personalized advice."
Managing Fatigue in Pregnancy,"Why am I feeling so tired during my pregnancy, and what can I do about it?","Feeling tired is common during pregnancy due to hormonal changes and the growing baby. To manage fatigue, make sure you rest when possible, take short naps, and try to sleep early. Eating nutritious foods and staying hydrated can also help boost your energy. Gentle exercises, like walking, may improve your mood and help you feel more awake."
Cultural Beliefs About Childbirth,What cultural practices should I be aware of when preparing for childbirth?,"Many families have special traditions and beliefs around childbirth, such as specific rituals or customs to follow. It's important to discuss these with your family to understand what is expected. Some may believe in having a family member present during labor for support. Remember, you should feel comfortable with your choices, so talk to your family about what you want."
Pregnancy Warning Signs,What signs should I look out for that might mean I need immediate help during pregnancy?,"It’s important to watch for any sudden changes like heavy bleeding, severe pain, or fluid leaking. If you have trouble breathing or feel very dizzy, you should seek help right away. Also, if you notice your baby isn’t moving as much as before, contact your doctor. Taking care of your health and baby's well-being is essential, so don't hesitate to get help."
