Theme,Questions,Answer,Hindi,Marathi,References
Are STDs Life-Threatening,1. Are sexually transmitted diseases life-threatening?,"Yes, some sexually transmitted diseases can be life-threatening if not treated. Late stages of HIV, AIDS, and syphilis can cause severe illness or even death. Early detection and proper treatment are very important to prevent serious health problems from these diseases. Regular checkups and safe practices help reduce your risk.","हां, कुछ यौन संचारित रोग अगर इलाज न किया जाए तो जानलेवा हो सकते हैं। एचआईवी, एड्स और सिफलिस के अंतिम चरण गंभीर बीमारी या यहां तक ​​कि मौत का कारण बन सकते हैं। इन बीमारियों से होने वाली गंभीर स्वास्थ्य समस्याओं को रोकने के लिए शुरुआती पहचान और उचित उपचार बहुत महत्वपूर्ण हैं। नियमित जांच और सुरक्षित अभ्यास आपके जोखिम को कम करने में मदद करते हैं।","हो, काही लैंगिक संक्रमित आजारांवर उपचार न केल्यास ते जीवघेणे ठरू शकतात. एचआयव्ही, एड्स आणि सिफिलीसच्या उशिरा होणाऱ्या आजारांमुळे गंभीर आजार होऊ शकतो किंवा मृत्यूही होऊ शकतो. या आजारांपासून होणाऱ्या गंभीर आरोग्य समस्या टाळण्यासाठी लवकर निदान आणि योग्य उपचार खूप महत्वाचे आहेत. नियमित तपासणी आणि सुरक्षित पद्धती तुमचा धोका कमी करण्यास मदत करतात.",https://www.healthline.com/health/stds-that-cannot-be-cured    https://www.who.int/news-room/fact-sheets/detail/sexually-transmitted-infections-(stis)    https://www.vinmec.com/eng/blog/some-dangerous-sexually-transmitted-diseases-en  
STD Prevention,1. How to avoid sexually transmitted diseases?,"To avoid sexually transmitted diseases, always use condoms correctly during sex and avoid having multiple sexual partners. Regular screening and testing are important, even if you have no symptoms, as some STDs can be silent. Openly discuss sexual health with your partner and seek medical advice if needed. These steps greatly reduce your risk of getting or spreading STDs.","यौन संचारित रोगों से बचने के लिए, सेक्स के दौरान हमेशा कंडोम का सही तरीके से इस्तेमाल करें और कई यौन साथी रखने से बचें। नियमित जांच और परीक्षण महत्वपूर्ण हैं, भले ही आपको कोई लक्षण न हों, क्योंकि कुछ एसटीडी चुपचाप हो सकते हैं। अपने साथी के साथ यौन स्वास्थ्य पर खुलकर चर्चा करें और ज़रूरत पड़ने पर डॉक्टर से सलाह लें। ये कदम एसटीडी होने या फैलने के आपके जोखिम को बहुत कम कर देते हैं।","लैंगिक संक्रमित आजार टाळण्यासाठी, सेक्स करताना नेहमीच कंडोमचा योग्य वापर करा आणि अनेक लैंगिक भागीदार असणे टाळा. काही लैंगिक आजार शांत राहू शकतात, त्यामुळे लक्षणे नसली तरीही नियमित तपासणी आणि चाचणी करणे महत्वाचे आहे. तुमच्या जोडीदाराशी लैंगिक आरोग्याबद्दल मोकळेपणाने चर्चा करा आणि गरज पडल्यास वैद्यकीय सल्ला घ्या. या पायऱ्यांमुळे लैंगिक आजार होण्याचा किंवा पसरण्याचा धोका खूप कमी होतो.",https://www.ferty9.com/blog/stds-prevention   https://pubmed.ncbi.nlm.nih.gov/16336765/    https://www.webmd.com/sex-relationships/understanding-stds-prevention     https://news.uams.edu/2024/08/27/screenings-save-lives-the-importance-of-regular-sexual-and-reproductive-health-screenings/  
Using Contraceptive,1. Talk about how the usage of condoms can help with avoiding sexually transmitted diseases.,"Condoms act as a physical barrier that prevents the exchange of bodily fluids during sex, which helps stop bacteria and viruses from passing between partners. When used correctly every time, condoms greatly reduce the risk of getting or spreading many sexually transmitted diseases like HIV, gonorrhea, and chlamydia. However, they may offer less protection against infections spread by skin-to-skin contact, such as herpes and HPV. Using condoms is one of the most effective ways to protect yourself and your partner from most STDs.","कंडोम एक शारीरिक अवरोध के रूप में कार्य करता है जो सेक्स के दौरान शारीरिक तरल पदार्थों के आदान-प्रदान को रोकता है, जो बैक्टीरिया और वायरस को भागीदारों के बीच पारित होने से रोकने में मदद करता है। जब हर बार सही तरीके से इस्तेमाल किया जाता है, तो कंडोम एचआईवी, गोनोरिया और क्लैमाइडिया जैसी कई यौन संचारित बीमारियों के होने या फैलने के जोखिम को बहुत कम कर देता है। हालाँकि, वे त्वचा से त्वचा के संपर्क से फैलने वाले संक्रमणों, जैसे कि हर्पीज और एचपीवी के खिलाफ कम सुरक्षा प्रदान कर सकते हैं। कंडोम का उपयोग करना अपने आप को और अपने साथी को अधिकांश एसटीडी से बचाने के सबसे प्रभावी तरीकों में से एक है।","कंडोम हे शारीरिक अडथळा म्हणून काम करतात जे सेक्स दरम्यान शारीरिक द्रवपदार्थांच्या देवाणघेवाणीला प्रतिबंधित करते, ज्यामुळे जोडीदारांमध्ये बॅक्टेरिया आणि विषाणूंचा संसर्ग रोखण्यास मदत होते. प्रत्येक वेळी योग्यरित्या वापरल्यास, कंडोम एचआयव्ही, गोनोरिया आणि क्लॅमिडीया सारख्या अनेक लैंगिक संक्रमित रोगांचा धोका कमी करतात. तथापि, ते हर्पिस आणि एचपीव्ही सारख्या त्वचेपासून त्वचेच्या संपर्कातून पसरणाऱ्या संसर्गांपासून कमी संरक्षण देऊ शकतात. बहुतेक एसटीडींपासून स्वतःचे आणि तुमच्या जोडीदाराचे संरक्षण करण्याचा सर्वात प्रभावी मार्ग म्हणजे कंडोम वापरणे.",https://www.cdc.gov/condom-use/index.html    https://www.medicalnewstoday.com/articles/contraceptives-that-prevent-stds   https://www.who.int/news-room/fact-sheets/detail/condoms  
Breast Changes During Pregnancy,"1. How will my breasts change throughout my pregnancy?
2. What type of bra should I wear for comfort as my breasts change?","During pregnancy, your breasts will become fuller and more sensitive, and your nipples may enlarge and become darker. Some women may also notice leakage of colostrum, a yellowish fluid, before delivery. For comfort, wear a soft, supportive cotton bra with wide straps and avoid tight or underwire bras. If you notice lumps, redness, or blood, consult your doctor.","गर्भावस्था के दौरान, आपके स्तन अधिक भरे हुए और अधिक संवेदनशील हो जाएंगे, और आपके निप्पल बड़े हो सकते हैं और गहरे रंग के हो सकते हैं। कुछ महिलाओं को प्रसव से पहले कोलोस्ट्रम, एक पीले रंग का तरल पदार्थ, का रिसाव भी दिखाई दे सकता है। आराम के लिए, चौड़ी पट्टियों वाली मुलायम, सहायक सूती ब्रा पहनें और टाइट या अंडरवायर ब्रा से बचें। यदि आपको गांठ, लालिमा या खून दिखाई देता है, तो अपने डॉक्टर से परामर्श करें।","गर्भधारणेदरम्यान, तुमचे स्तन अधिक भरलेले आणि संवेदनशील होतील आणि तुमचे स्तनाग्र मोठे आणि गडद होऊ शकतात. काही महिलांना प्रसूतीपूर्वी कोलोस्ट्रम, एक पिवळा द्रव गळती देखील जाणवू शकते. आरामासाठी, रुंद पट्ट्यांसह मऊ, आधार देणारी कापसाची अंतर्वस्त्र  घाला आणि घट्ट किंवा अंतर्वस्त्र टाळा. जर तुम्हाला गाठी, लालसरपणा किंवा रक्त दिसले तर तुमच्या डॉक्टरांचा सल्ला घ्या.","ICMR Nutrition Guide, NHS Heartburn Advice"
Breast changes before delivery,1. Is it normal to experience breast tenderness or leakage of colostrum before delivery?,"Yes, it is normal for some women to experience breast tenderness and even leakage of colostrum (the first milk) before delivery. These changes happen as the body prepares for breastfeeding and are usually not a cause for concern. If you notice excessive leakage or have any worries, consult your doctor for advice and reassurance.","हां, कुछ महिलाओं के लिए प्रसव से पहले स्तन कोमलता और यहां तक ​​कि कोलोस्ट्रम (पहला दूध) का रिसाव होना सामान्य है। ये परिवर्तन तब होते हैं जब शरीर स्तनपान के लिए तैयार होता है और आमतौर पर चिंता का कारण नहीं होते हैं। यदि आपको अत्यधिक रिसाव दिखाई देता है या कोई चिंता है, तो सलाह और आश्वासन के लिए अपने डॉक्टर से परामर्श करें।","हो, काही महिलांना प्रसूतीपूर्वी स्तनांमध्ये कोमलता येणे आणि कोलोस्ट्रम (पहिले दूध) गळती होणे हे सामान्य आहे. शरीर स्तनपानासाठी तयार होत असताना हे बदल होतात आणि सहसा काळजीचे कारण नसतात. जर तुम्हाला जास्त गळती दिसून आली किंवा तुम्हाला काही चिंता वाटत असेल, तर सल्ला आणि आश्वासनासाठी तुमच्या डॉक्टरांचा सल्ला घ्या.",https://www.apollohospitals.com/health-library/breast-leaking-during-pregnancy-what-mothers-need-to-know   https://motherandchildhospital.com/care-of-the-breast-in-pregnancy-and-after-delivery/     https://www.fortishealthcare.com/blogs/breast-leaking-during-pregnancy-what-expecting-mothers-should-know  
Stretch Marks in Pregnancy,"1. What are stretch marks, and how can I prevent or treat them during pregnancy?","Stretch marks are lines that appear on the abdomen, buttocks, and shoulders when the skin stretches quickly during pregnancy. They are very common and not harmful. You can help reduce your risk by applying oils or creams to keep the skin soft during the latter half of pregnancy, gaining weight gradually, and eating a healthy diet. Most stretch marks fade with time after delivery, but there is no proven way to prevent them completely.","स्ट्रेच मार्क्स वे रेखाएं हैं जो गर्भावस्था के दौरान त्वचा के तेजी से खिंचने पर पेट, नितंबों और कंधों पर दिखाई देती हैं। ये बहुत आम हैं और हानिकारक नहीं हैं। गर्भावस्था के उत्तरार्ध के दौरान त्वचा को मुलायम बनाए रखने के लिए तेल या क्रीम लगाकर, धीरे-धीरे वजन बढ़ाकर और स्वस्थ आहार खाकर आप अपने जोखिम को कम करने में मदद कर सकते हैं। प्रसव के बाद समय के साथ ज़्यादातर स्ट्रेच मार्क्स फीके पड़ जाते हैं, लेकिन उन्हें पूरी तरह से रोकने का कोई सिद्ध तरीका नहीं है।","स्ट्रेच मार्क्स म्हणजे गर्भधारणेदरम्यान त्वचा लवकर ताणली गेल्यावर पोट, नितंब आणि खांद्यावर दिसणाऱ्या रेषा. त्या खूप सामान्य आहेत आणि हानिकारक नाहीत. गर्भधारणेच्या उत्तरार्धात त्वचा मऊ ठेवण्यासाठी तेल किंवा क्रीम लावून, हळूहळू वजन वाढवून आणि निरोगी आहार घेऊन तुम्ही तुमचा धोका कमी करू शकता. प्रसूतीनंतर बहुतेक स्ट्रेच मार्क्स कालांतराने कमी होतात, परंतु ते पूर्णपणे रोखण्याचा कोणताही पूर्णतहा  मार्ग नाही.",https://www.nhs.uk/pregnancy/related-conditions/common-symptoms/stretch-marks/    https://www.apollohospitals.com/diseases-and-conditions/pregnancy-stretch-marks-during-and-after-pregnancy-and-what-to-expect    https://www.babyforest.in/blogs/thoughts-and-ideas/home-remedies-to-prevent-and-reduce-pregnancy-stretch-marks    https://www.apollocradle.com/blog/pregnancy/5-tips-to-avoid-stretch-marks-during-pregnancy    https://www.in.pampers.com/pregnancy/pregnancy-symptoms/article/how-to-prevent-and-treat-pregnancy-stretch-marks  
Skin Pigmentation Changes in Pregnancy,"1. Why do I notice changes in skin pigmentation, such as melasma or linea nigra?","Changes in skin pigmentation, like melasma (dark patches on the face) or linea nigra (a dark line on the belly), are common during pregnancy and are caused by hormonal changes. Women with darker skin tones are more likely to notice these changes, but they are harmless and usually fade a few months after delivery. No special treatment is needed—just protect your skin from the sun and avoid harsh creams or bleaches.","त्वचा के रंग में बदलाव, जैसे मेलास्मा (चेहरे पर काले धब्बे) या लिनिया निग्रा (पेट पर एक काली रेखा), गर्भावस्था के दौरान आम हैं और ये हार्मोनल परिवर्तनों के कारण होते हैं। गहरे रंग की त्वचा वाली महिलाओं में ये बदलाव दिखने की संभावना ज़्यादा होती है, लेकिन ये हानिरहित होते हैं और आमतौर पर डिलीवरी के कुछ महीनों बाद फीके पड़ जाते हैं। किसी विशेष उपचार की ज़रूरत नहीं है - बस अपनी त्वचा को धूप से बचाएँ और कठोर क्रीम या ब्लीच से बचें।","गर्भधारणेदरम्यान त्वचेच्या रंगद्रव्यात बदल, जसे की मेलास्मा (चेहऱ्यावर काळे डाग) किंवा लिनिया निग्रा (पोटावर काळी रेषा) सामान्य असतात आणि ते हार्मोनल बदलांमुळे होतात. गडद त्वचेचा रंग असलेल्या महिलांना हे बदल लक्षात येण्याची शक्यता जास्त असते, परंतु ते निरुपद्रवी असतात आणि सामान्यतः प्रसूतीनंतर काही महिन्यांनी फिकट होतात. कोणत्याही विशेष उपचारांची आवश्यकता नाही - फक्त तुमच्या त्वचेचे उन्हापासून संरक्षण करा आणि कठोर क्रीम किंवा ब्लीच टाळा.",https://www.healthline.com/health/pregnancy/melasma-pregnancy  https://pmc.ncbi.nlm.nih.gov/articles/PMC11490249/    https://blogs.bcm.edu/2023/08/15/why-your-skin-changes-with-pregnancy/    https://pmc.ncbi.nlm.nih.gov/articles/PMC11490249/    https://pubmed.ncbi.nlm.nih.gov/38074022/    https://pmc.ncbi.nlm.nih.gov/articles/PMC3183040/  
Safe Skincare in Pregnancy,1. Are there safe skincare products I can use to address skin changes during pregnancy?,"Use simple, natural products like coconut oil or besan (gram flour) for your skin during pregnancy. Avoid creams with strong chemicals, retinoids, or unknown herbal ingredients. Do not get salon treatments or bleach your skin. Drink plenty of water to keep your skin healthy. If you want to try a new product, always check with your doctor first. If you notice a rash or itching, see a health worker.","गर्भावस्था में नारियल तेल या बेसन जैसे साधारण प्राकृतिक उत्पादों का प्रयोग करें। तेज रसायन, रेटिनोइड या अज्ञात हर्बल क्रीम से बचें। सैलून ट्रीटमेंट या ब्लीच न करवाएं। त्वचा को स्वस्थ रखने के लिए खूब पानी पिएं। नया उत्पाद आजमाने से पहले डॉक्टर से पूछें। अगर खुजली या दाने हों तो स्वास्थ्यकर्मी से मिलें।","गर्भारपणात नारळ तेल किंवा बेसन सारखे साधे नैसर्गिक उत्पादने वापरा. तीव्र रसायने, रेटिनोइड किंवा अज्ञात हर्बल क्रीम टाळा. सलून ट्रीटमेंट किंवा ब्लीच करू नका. त्वचा निरोगी ठेवण्यासाठी भरपूर पाणी प्या. नवीन उत्पाद वापरण्यापूर्वी डॉक्टरांचा सल्ला घ्या. पुरळ किंवा खाज आली तर आरोग्य सेवकांना दाखवा.","ICMR Dietary Advice, WHO Pregnancy Care"
Heartburn and Indigestion in Pregnancy,1. Why do I experience heartburn or indigestion during pregnancy?,"Heartburn or indigestion is common during pregnancy because hormonal changes relax the stomach muscles and slow digestion. You can reduce discomfort by avoiding oily and spicy foods, eating small frequent meals, and not lying down immediately after eating. These simple steps help manage acidity and keep you more comfortable. If symptoms are severe, consult your doctor.","गर्भावस्था के दौरान सीने में जलन या अपच होना आम बात है क्योंकि हार्मोनल परिवर्तन पेट की मांसपेशियों को शिथिल कर देते हैं और पाचन को धीमा कर देते हैं। आप तैलीय और मसालेदार भोजन से परहेज करके, बार-बार थोड़ा-थोड़ा करके भोजन करके और खाने के तुरंत बाद लेट न कर असुविधा को कम कर सकते हैं। ये सरल उपाय एसिडिटी को नियंत्रित करने और आपको अधिक आरामदायक रखने में मदद करते हैं। यदि लक्षण गंभीर हैं, तो अपने डॉक्टर से परामर्श करें।","गर्भधारणेदरम्यान छातीत जळजळ किंवा अपचन होणे सामान्य आहे कारण हार्मोनल बदलांमुळे पोटाचे स्नायू शिथिल होतात आणि पचन मंदावते. तेलकट आणि मसालेदार पदार्थ टाळून, थोडे थोडे वारंवार जेवण करून आणि जेवणानंतर लगेच झोपून न राहून तुम्ही अस्वस्थता कमी करू शकता. हे सोपे उपाय आम्लता नियंत्रित करण्यास आणि तुम्हाला अधिक आरामदायी ठेवण्यास मदत करतात. लक्षणे तीव्र असल्यास, तुमच्या डॉक्टरांचा सल्ला घ्या.","NHM Self-Care Guide, WHO Pregnancy Care"
