Theme,Questions,Answer,Hindi,Marathi,References
Cultural Myths About Pregnancy,"1. Is it true that eating or drinking brown-colored food or liquid results in the dark color of the skin for the child?
2. Is it true that a mother's beauty decreases if she is carrying a girl?
3. Is it true that a baby resembles the person, thing, or animal the mother frequently looks at during pregnancy?
4. Are there beliefs that suggest I should avoid certain activities, like raising my arms above my head, to prevent complications?","Many beliefs about food, appearance, or activities affecting your baby's looks or gender are myths and not true. Eating brown foods does not change your baby's skin color. The way you look during pregnancy does not tell if you are having a boy or a girl. Babies do not look like what you see or think about. Raising your arms or doing normal activities does not cause harm, but always follow your doctor’s advice for safety. Trust medical advice for a healthy pregnancy.","भोजन, रूप या गतिविधियों से बच्चे के रंग या लिंग पर असर पड़ता है, ऐसी कई मान्यताएं मिथक हैं और सच नहीं हैं। भूरे रंग का खाना खाने से बच्चे का रंग नहीं बदलता। गर्भावस्था के दौरान आपका रूप देखकर यह नहीं पता चलता कि लड़का होगा या लड़की। बच्चा वैसा नहीं दिखता जैसा आप देखती या सोचती हैं। हाथ ऊपर उठाना या सामान्य काम करने से कोई नुकसान नहीं होता, लेकिन सुरक्षा के लिए डॉक्टर की सलाह मानें। स्वस्थ गर्भावस्था के लिए मेडिकल सलाह पर भरोसा करें।","अन्न, दिसणे किंवा कृतीमुळे बाळाचा रंग किंवा लिंग बदलतो, अशा अनेक समजुती मिथ्या आहेत आणि खऱ्या नाहीत. तपकिरी रंगाचे अन्न खाल्ल्याने बाळाचा रंग बदलत नाही. गर्भारपणात दिसणं पाहून मुलगा की मुलगी हे ठरत नाही. बाळ तशी दिसत नाही जशी तुम्ही पाहता किंवा विचार करता. हात वर उचलणे किंवा सामान्य काम केल्याने काहीही होत नाही, पण सुरक्षिततेसाठी डॉक्टरांचा सल्ला घ्या. निरोगी गर्भारपणासाठी वैद्यकीय सल्ल्यावर विश्वास ठेवा.","NHM Nutrition Guide, WHO Weight Gain"
Warning Signs & Emergencies in Pregnancy,"1. What signs of discomfort should prompt me to contact my healthcare provider?
2. What are the warning signs during pregnancy that require immediate medical attention?
3. What should I do if I experience bleeding or severe pain during pregnancy?
4. What are signs that I should call my doctor immediately?","Contact your doctor or go to the hospital immediately if you have any of these warning signs during pregnancy: pain in the abdomen, bleeding from the vagina, leaking of water from the vagina, severe headache, loss of consciousness, blurred vision, or if you feel your baby is moving less than usual. These symptoms can signal serious problems for you or your baby and need urgent medical attention.","अगर आपको गर्भावस्था के दौरान इनमें से कोई भी चेतावनी संकेत दिखाई दे तो तुरंत अपने डॉक्टर से संपर्क करें या अस्पताल जाएँ: पेट में दर्द, योनि से खून बहना, योनि से पानी का रिसाव, तेज सिरदर्द, बेहोशी, धुंधली दृष्टि, या अगर आपको लगे कि आपका शिशु सामान्य से कम हिल रहा है। ये लक्षण आपके या आपके शिशु के लिए गंभीर समस्याओं का संकेत हो सकते हैं और इसके लिए तत्काल चिकित्सा की आवश्यकता होती है।","गर्भधारणेदरम्यान जर तुम्हाला यापैकी कोणतीही चेतावणी चिन्हे आढळली तर ताबडतोब तुमच्या डॉक्टरांशी संपर्क साधा किंवा रुग्णालयात जा: ओटीपोटात वेदना, योनीतून रक्तस्त्राव, योनीतून पाणी गळणे, तीव्र डोकेदुखी, बेशुद्धी, अंधुक दृष्टी किंवा जर तुम्हाला वाटत असेल की तुमचे बाळ नेहमीपेक्षा कमी हालचाल करत आहे. ही लक्षणे तुमच्यासाठी किंवा तुमच्या बाळासाठी गंभीर समस्या दर्शवू शकतात आणि त्यांना तातडीने वैद्यकीय मदतीची आवश्यकता आहे.","CDC Warning Signs, NHM Danger Signs   https://www.pregnancybirthbaby.org.au/warning-signs-during-pregnancy    https://www.inspq.qc.ca/en/tiny-tot/pregnancy/health-during-pregnancy/warning-signs     https://pmc.ncbi.nlm.nih.gov/articles/PMC10036572/  "
Postpartum Checkups and Self-Care,"1. When should I schedule my postpartum check-up with a healthcare provider?
","You should see a healthcare worker between 3 to 6 weeks after delivery. This check-up helps see how your body is healing, checks your bleeding, and looks at your mood. It is important for your health and your baby’s well-being. If you have pain, fever, or heavy bleeding before this, visit your doctor or health worker earlier.","आपको प्रसव के 3 से 6 सप्ताह के बीच स्वास्थ्य सेवा कर्मी से मिलना चाहिए। यह जांच यह देखने में मदद करती है कि आपका शरीर कैसे ठीक हो रहा है, आपके रक्तस्राव की जांच करता है और आपके मूड को देखता है। यह आपके स्वास्थ्य और आपके बच्चे की भलाई के लिए महत्वपूर्ण है। यदि आपको इससे पहले दर्द, बुखार या भारी रक्तस्राव होता है, तो अपने डॉक्टर या स्वास्थ्य कर्मी से पहले मिलें।","बाळंतपणानंतर ३ ते ६ आठवड्यांच्या आत तुम्ही आरोग्यसेवा कर्मचाऱ्याला भेटले पाहिजे. या तपासणीमुळे तुमचे शरीर कसे बरे होत आहे हे पाहण्यास मदत होते, तुमचा रक्तस्त्राव तपासला जातो आणि तुमचा मूड पाहिला जातो. तुमच्या आरोग्यासाठी आणि तुमच्या बाळाच्या आरोग्यासाठी हे महत्वाचे आहे. जर तुम्हाला याआधी वेदना, ताप किंवा जास्त रक्तस्त्राव होत असेल तर तुमच्या डॉक्टरांना किंवा आरोग्य कर्मचाऱ्याला लवकर भेटा.",https://www.who.int/news-room/fact-sheets/detail/postnatal-care    https://www.acog.org/womens-health/faqs/routine-postpartum-care    https://nhm.gov.in/images/pdf/programmes/maternal-health/guidelines/Postnatal_Care_Operational_Guidelines.pdf  
"Rest, Healthy Eating, Emotional Support",1. How can I care for myself physically and emotionally after delivery?,"Rest as much as you can, eat healthy food, and drink plenty of water. Ask family to help with housework. Keep your stitches clean and dry. If you feel very sad, worried, or tired for more than two weeks, talk to your doctor or ASHA worker. Taking care of yourself helps you and your baby stay healthy.","जितना हो सके उतना आराम करें, स्वस्थ भोजन खाएं और खूब पानी पिएं। घर के कामों में परिवार से मदद मांगें। अपने टांकों को साफ और सूखा रखें। अगर आप दो सप्ताह से ज़्यादा समय तक बहुत उदास, चिंतित या थका हुआ महसूस करते हैं, तो अपने डॉक्टर या आशा कार्यकर्ता से बात करें। अपना ख्याल रखने से आपको और आपके बच्चे को स्वस्थ रहने में मदद मिलती है।","शक्य तितका आराम करा, सकस अन्न खा आणि भरपूर पाणी प्या. घरकामात कुटुंबाला मदत करण्यास सांगा. तुमचे टाके स्वच्छ आणि कोरडे ठेवा. जर तुम्हाला दोन आठवड्यांपेक्षा जास्त काळ खूप दुःखी, काळजीत किंवा थकवा जाणवत असेल तर तुमच्या डॉक्टरांशी किंवा आशा वर्करशी बोला. स्वतःची काळजी घेतल्याने तुम्ही आणि तुमचे बाळ निरोगी राहण्यास मदत होते.",https://www.who.int/news-room/fact-sheets/detail/postnatal-care    https://www.acog.org/womens-health/faqs/routine-postpartum-care    https://nhm.gov.in/images/pdf/programmes/maternal-health/guidelines/Postnatal_Care_Operational_Guidelines.pdf  
Immediate Newborn Care,1. What immediate care does my newborn need after birth?,"Right after birth, keep your baby warm, dry, and close to your chest. Start breastfeeding within one hour. Make sure your baby is breathing well and has clean, dry clothes. Do not bathe your baby right away-wait at least 24 hours. Clean the umbilical cord with dry cloth and keep it uncovered. Go to the health center for a checkup and vaccinations.","जन्म के तुरंत बाद, अपने बच्चे को गर्म, सूखा और अपनी छाती से चिपकाकर रखें। एक घंटे के भीतर स्तनपान शुरू करें। सुनिश्चित करें कि बच्चा ठीक से सांस ले रहा है और उसके कपड़े साफ-सुथरे और सूखे हैं। बच्चे को तुरंत न नहलाएं-कम से कम 24 घंटे इंतजार करें। नाभि को सूखे कपड़े से साफ करें और खुला रखें। चेकअप और टीकाकरण के लिए स्वास्थ्य केंद्र जाएं।","बाळाचा जन्म झाल्यावर लगेच त्याला उबदार, कोरडे आणि आपल्या छातीजवळ ठेवा. एका तासात स्तनपान सुरू करा. बाळ व्यवस्थित श्वास घेत आहे आणि कपडे स्वच्छ, कोरडे आहेत याची खात्री करा. बाळाला लगेच आंघोळ घालू नका-किमान २४ तास थांबा. नाळ कोरड्या कपड्याने स्वच्छ करा आणि उघडी ठेवा. तपासणी आणि लसीकरणासाठी आरोग्य केंद्रात जा.","NHM ANC Guidelines, WHO Pregnancy Testing"
Newborn Feeding and Hunger Cues,"1. How often should I feed my baby, and what signs indicate they are hungry?","Feed your baby every 2-3 hours, even at night, or whenever your baby cries, sucks on hands, or moves mouth. Babies show hunger by turning their head, making sucking sounds, or being fussy. Breast milk is best for the first 6 months. Do not give water, honey, or other foods. If your baby is not feeding well or seems weak, see a health worker.","अपने बच्चे को मांग पर दूध पिलाएँ, आमतौर पर हर 2-3 घंटे में, रात में भी, 24 घंटे में कुल मिलाकर लगभग 8-12 बार। आपके बच्चे के भूखे होने के संकेतों में हाथों को चूसना, स्तन की तलाश में अपना सिर घुमाना, या अधिक सतर्क और चिड़चिड़ा होना शामिल है। मांग पर दूध पिलाने से यह सुनिश्चित होता है कि आपके बच्चे को पर्याप्त पोषण मिले और उसे अच्छी तरह से बढ़ने में मदद मिले। अगर आपका बच्चा ठीक से दूध नहीं पी रहा है या कमज़ोर लग रहा है, तो अपने स्वास्थ्य कार्यकर्ता से सलाह लें।","तुमच्या बाळाला मागणीनुसार, साधारणपणे दर २-३ तासांनी, रात्रीसह, २४ तासांतून एकूण ८-१२ वेळा खायला द्या. तुमच्या बाळाला भूक लागल्याची लक्षणे म्हणजे हात चोखणे, स्तन शोधण्यासाठी डोके फिरवणे किंवा अधिक सतर्क आणि चंचल होणे. मागणीनुसार खायला दिल्याने तुमच्या बाळाला पुरेसे पोषण मिळते आणि त्यांची वाढ चांगली होते. जर तुमचे बाळ नीट खात नसेल किंवा अशक्त दिसत असेल तर तुमच्या आरोग्य कर्मचाऱ्याचा सल्ला घ्या.","NHM High-Risk Pregnancy, WHO Risk Factors"
Newborn Vaccinations,"1. What vaccinations does my newborn need, and when should they be given?","Your newborn should get vaccines as per the Government of India’s immunization schedule, starting with BCG, Hepatitis B, and Oral Polio Vaccine (OPV) at birth. Further vaccines are given at 6, 10, and 14 weeks, and then at 9 months and beyond, up to 10 years of age. These vaccines protect your child from serious diseases like tuberculosis, polio, and hepatitis. Always follow the schedule given by your health center and keep the immunization card safe for each visit.","आपके नवजात शिशु को भारत सरकार के टीकाकरण कार्यक्रम के अनुसार टीके लगवाने चाहिए, जन्म के समय BCG, हेपेटाइटिस B और ओरल पोलियो वैक्सीन (OPV) से शुरू करना चाहिए। आगे के टीके 6, 10 और 14 सप्ताह में दिए जाते हैं, और फिर 9 महीने और उसके बाद, 10 साल की उम्र तक दिए जाते हैं। ये टीके आपके बच्चे को टीबी, पोलियो और हेपेटाइटिस जैसी गंभीर बीमारियों से बचाते हैं। हमेशा अपने स्वास्थ्य केंद्र द्वारा दिए गए शेड्यूल का पालन करें और हर बार टीकाकरण कार्ड को सुरक्षित रखें।","तुमच्या नवजात बाळाला भारत सरकारच्या लसीकरण वेळापत्रकानुसार लसीकरण करावे, जन्माच्या वेळी बीसीजी, हेपेटायटीस बी आणि ओरल पोलिओ लस (ओपीव्ही) पासून सुरुवात करावी. पुढील लसीकरण ६, १० आणि १४ आठवड्यांनी आणि नंतर ९ महिने आणि त्याहून अधिक वयाच्या १० वर्षांपर्यंत दिले जाते. या लसी तुमच्या बाळाचे क्षयरोग, पोलिओ आणि हेपेटायटीस सारख्या गंभीर आजारांपासून संरक्षण करतात. तुमच्या आरोग्य केंद्राने दिलेल्या वेळापत्रकाचे नेहमी पालन करा आणि प्रत्येक भेटीसाठी लसीकरण कार्ड सुरक्षित ठेवा.","ICMR Herbal Safety, WHO Herbal Use   https://www.sbigeneral.in/blog/health-insurance/health-articles/newborn-baby-vaccination-chart    https://www.iitk.ac.in/hc/index.php/vaccination-schedule    https://www.acko.com/health-insurance/s/health-tips/baby-health/vaccination-chart-newborn-baby/  "
Breastfeeding Best Practices,1. How can I ensure I am following best practices for breastfeeding?,"Start breastfeeding within one hour of birth. Hold your baby close and make sure their mouth covers most of your nipple. Feed your baby every 2-3 hours, day and night. Do not give honey, water, or other foods for the first six months. Eat healthy foods and drink water to keep your milk flowing. If you have pain or trouble, ask your ASHA worker or nurse for help. Breastfeeding protects your baby from sickness and helps you recover faster.","जन्म के एक घंटे के भीतर स्तनपान शुरू करें। बच्चे को पास रखें और सुनिश्चित करें कि उसका मुंह निप्पल का अधिकांश हिस्सा ढंकता है। हर 2-3 घंटे में, दिन-रात दूध पिलाएं। पहले छह महीने तक शहद, पानी या अन्य कोई चीज न दें। दूध बनाए रखने के लिए पौष्टिक भोजन और पानी पिएं। दर्द या परेशानी हो तो आशा या नर्स से मदद लें। स्तनपान बच्चे को बीमारियों से बचाता है और आपकी रिकवरी में मदद करता है।","जन्मानंतर एका तासात स्तनपान सुरू करा. बाळाला जवळ ठेवा आणि त्याचे तोंड निप्पलचा जास्तीत जास्त भाग झाकते याची खात्री करा. दिवस-रात्र दर २-३ तासांनी दूध पाजावे. पहिल्या सहा महिन्यांत मध, पाणी किंवा इतर काहीही देऊ नका. दूध येण्यासाठी पौष्टिक अन्न आणि पाणी प्या. वेदना किंवा त्रास झाल्यास आशा किंवा नर्सची मदत घ्या. स्तनपान बाळाला आजारांपासून वाचवते आणि तुमच्या बरे होण्यास मदत करते.","NHM ASHA Program, UNICEF Support"
Prenatal Vitamins,"1. Are prenatal vitamins really necessary if I eat healthy?
","Yes, you should take prenatal vitamins even if you eat healthy food. Your body needs extra iron and folic acid for your baby’s growth and to prevent anemia and birth defects. Most healthy foods cannot give you enough of these during pregnancy. Take your supplements as advised by your doctor or health worker for a healthy pregnancy.","हां, अगर आप स्वस्थ भोजन खाते हैं तो भी आपको प्रसवपूर्व विटामिन लेना चाहिए। आपके शरीर को आपके बच्चे के विकास और एनीमिया और जन्म दोषों को रोकने के लिए अतिरिक्त आयरन और फोलिक एसिड की आवश्यकता होती है। अधिकांश स्वस्थ खाद्य पदार्थ आपको गर्भावस्था के दौरान पर्याप्त मात्रा में ये नहीं दे सकते। स्वस्थ गर्भावस्था के लिए अपने डॉक्टर या स्वास्थ्य कार्यकर्ता की सलाह के अनुसार अपने सप्लीमेंट लें।","हो, तुम्ही निरोगी अन्न खाल्ले तरी तुम्ही प्रसूतीपूर्व जीवनसत्त्वे घेतली पाहिजेत. तुमच्या बाळाच्या वाढीसाठी आणि अशक्तपणा आणि जन्मजात दोष टाळण्यासाठी तुमच्या शरीराला अतिरिक्त लोह आणि फॉलिक अॅसिडची आवश्यकता असते. बहुतेक निरोगी अन्न तुम्हाला गर्भधारणेदरम्यान पुरेसे लोह आणि फॉलिक अॅसिड देऊ शकत नाहीत. निरोगी गर्भधारणेसाठी तुमच्या डॉक्टरांनी किंवा आरोग्य कर्मचाऱ्याने सल्ल्यानुसार तुमचे पूरक आहार घ्या.","NHM Hydration Tips, WHO Water Guidelines  https://my.clevelandclinic.org/health/drugs/9754-pregnancy-prenatal-vitamins  https://www.mayoclinic.org/healthy-lifestyle/pregnancy-week-by-week/in-depth/prenatal-vitamins/art-20046945  https://www.obgynassociatesmarietta.com/blog/yes-you-really-do-need-to-take-prenatal-vitamins  "
