Theme,Questions,Answer,Hindi,Marathi,References
Painful Periods and Pregnancy Risks,"1. If I had painful periods in the past does it affect my child?
","If you had painful periods in the past, it may or may not affect your pregnancy or child. Painful periods can be caused by conditions like endometriosis, fibroids, infections, or adenomyosis, which may increase the risk of pregnancy complications such as miscarriage, preterm birth, or low birth weight in some women. It’s important to share your menstrual history with your doctor so they can check for these conditions and provide the right care. Most women with painful periods still have healthy pregnancies, but regular checkups are important.","यदि आपको पहले भी दर्दनाक मासिक धर्म हुआ है, तो यह आपकी गर्भावस्था या बच्चे को प्रभावित कर सकता है या नहीं भी कर सकता है। दर्दनाक मासिक धर्म एंडोमेट्रियोसिस, फाइब्रॉएड, संक्रमण या एडेनोमायसिस जैसी स्थितियों के कारण हो सकता है, जो कुछ महिलाओं में गर्भपात, समय से पहले जन्म या कम वजन वाले बच्चे जैसी गर्भावस्था जटिलताओं के जोखिम को बढ़ा सकता है। अपने मासिक धर्म के इतिहास को अपने डॉक्टर के साथ साझा करना महत्वपूर्ण है ताकि वे इन स्थितियों की जांच कर सकें और सही देखभाल प्रदान कर सकें। दर्दनाक मासिक धर्म वाली अधिकांश महिलाओं की गर्भावस्था अभी भी स्वस्थ है, लेकिन नियमित जांच महत्वपूर्ण है।","जर तुम्हाला पूर्वी वेदनादायक मासिक पाळी आली असेल, तर त्याचा तुमच्या गर्भधारणेवर किंवा बाळावर परिणाम होऊ शकतो किंवा होऊ शकत नाही. वेदनादायक मासिक पाळीमुळे गर्भाशयाचे अस्तर सारखी ऊती वाढणे, गर्भाशयतील गाठ तयार होणे , संसर्ग किंवा गर्भाशयाच्या स्नायूंच्या भिंतीमध्ये गर्भाशयाच्या अस्तर ऊतीचे वाढणे . इ प्रारच्या समस्या वेदनदायी मासिक पळीमुळे होऊ शकते, ज्यामुळे काही महिलांमध्ये गर्भपात, मुदतपूर्व जन्म किंवा कमी वजन यासारख्या गर्भधारणेच्या गुंतागुंतीचा धोका वाढू शकतो. तुमच्या मासिक पाळीचा इतिहास तुमच्या डॉक्टरांशी संभाषण करणे महत्वाचे आहे जेणेकरून ते या परिस्थिती हाताळू शकतात  आणि योग्य काळजी घेण्याचा सल्ला देऊ शकतील. वेदनादायक मासिक पाळी असलेल्या बहुतेक महिलांना अजूनही निरोगी गर्भधारणा होते, परंतु नियमित तपासणी करणे महत्वाचे आहे.",https://pmc.ncbi.nlm.nih.gov/articles/PMC11351718/      https://pmc.ncbi.nlm.nih.gov/articles/PMC9187594/  https://flo.health/pregnancy/pregnancy-health/complications/adenomyosis-and-pregnancy  
Irregular Periods and Pregnancy Outcomes,1. Do my irregular periods affect my pregnancy and child?,"Irregular periods usually do not affect pregnancy or your child unless there is an underlying medical problem. If the cause is something like PCOS, thyroid disease, or other hormonal or structural issues, there may be a higher risk of complications such as pregnancy-induced hypertension, preterm birth, or low birth weight. Finding and treating the cause of irregular periods helps improve pregnancy outcomes, so always discuss your cycle with your doctor before and during pregnancy.","अनियमित मासिक धर्म आमतौर पर गर्भावस्था या आपके बच्चे को प्रभावित नहीं करते हैं जब तक कि कोई अंतर्निहित चिकित्सा समस्या न हो। यदि इसका कारण पीसीओएस, थायरॉयड रोग या अन्य हार्मोनल या संरचनात्मक समस्याएं हैं, तो गर्भावस्था से प्रेरित उच्च रक्तचाप, समय से पहले जन्म या कम वजन वाले जन्म जैसी जटिलताओं का अधिक जोखिम हो सकता है। अनियमित मासिक धर्म के कारण का पता लगाना और उसका इलाज करना गर्भावस्था के परिणामों को बेहतर बनाने में मदद करता है, इसलिए गर्भावस्था से पहले और उसके दौरान हमेशा अपने डॉक्टर से अपने चक्र के बारे में चर्चा करें।","जोपर्यंत शरीराच्या अंतर्गत वैद्यकीय समस्या उद्भवत नाही तो पर्यन्त अनियमित मासिक पाळीचा गर्भधारणेवर किंवा होणाऱ्या बाळावर कोणताही परिणाम होत नाही. ह्याचे  कारण PCOS, थायरॉईड रोग किंवा इतर हार्मोनल किंवा संरचनात्मक समस्या असतील, तर गर्भधारणेमुळे होणारे उच्च रक्तदाब, मुदतपूर्व जन्म किंवा वजन कमी होणे यासारख्या अंजारांचा  धोका होऊ शकतो. अनियमित मासिक पाळीचे कारण शोधणे आणि त्यावर उपचार करणे गर्भधारणेचे परिणाम सुधारण्यास मदत करते. म्हणून गर्भधारणेपूर्वी आणि मासिक पाळीच्या दरम्यान तुमच्या चक्राबद्दल नेहमीच तुमच्या डॉक्टरांशी चर्चा करा.",https://www.medicalnewstoday.com/articles/178635   https://www.healthline.com/health/pregnancy/irregular-periods-and-pregnancy     https://pmc.ncbi.nlm.nih.gov/articles/PMC10733621/  
Painful Periods After Childbirth,1. My friends say painful periods become normal after childbirth is this true?,"It is true that, for some women, painful periods (dysmenorrhea) may become less severe or even normal after childbirth, but this does not happen for everyone. Some women continue to have painful periods, especially if the pain is caused by conditions like endometriosis or fibroids. If you still have severe pain after childbirth, it is important to talk to your doctor for proper advice and care.","यह सच है कि कुछ महिलाओं के लिए प्रसव के बाद दर्दनाक मासिक धर्म (डिसमेनोरिया) कम गंभीर या सामान्य हो सकता है, लेकिन ऐसा सभी के साथ नहीं होता है। कुछ महिलाओं को दर्दनाक मासिक धर्म जारी रहता है, खासकर अगर दर्द एंडोमेट्रियोसिस या फाइब्रॉएड जैसी स्थितियों के कारण होता है। यदि आपको प्रसव के बाद भी गंभीर दर्द होता है, तो उचित सलाह और देखभाल के लिए अपने डॉक्टर से बात करना महत्वपूर्ण है।","हे खरे आहे की, काही महिलांमध्ये, बाळंतपणानंतर वेदनादायक मासिक पाळी (डिस्मेनोरिया) कमी, तीव्र किंवा अगदी सामान्य होऊ शकते, परंतु प्रत्येकाच्या बाबतीत असे घडत नाही. काही महिलांना वेदनादायक मासिक पाळी येत राहतात, विशेषतः जर शरीरात  वेदना अस्तर सारखी ऊती वाढणे( एंडोमेट्रिओसिस) किंवा गर्भाशयतील गाठ तयार होणे(फायब्रॉइड्स) सारख्या आजारांमुळे होतो. बाळंतपणानंतरही तुम्हाला तीव्र वेदना होत असतील, तर योग्य सल्ला आणि काळजी घेण्यासाठी तुमच्या डॉक्टरांशी बोलणे महत्वाचे आहे.","Anemia Control Guidelines, Postpartum Care"
Menstrual Irregularity After Childbirth,1. Will my irregular periods become regular after childbirth?,"It's normal to have irregular periods after childbirth, especially if breastfeeding. Your body needs time to recover. Cycles may remain irregular for 6-12 months. If periods don't return within 3 months after stopping breastfeeding, consult your healthcare worker. Keep track of your cycle dates. Don't use period pain as a sign of health problems unless severe.","प्रसव के बाद अनियमित पीरियड्स होना सामान्य है, खासकर स्तनपान कराने वाली माताओं में। शरीर को ठीक होने में समय चाहिए। 6-12 महीने तक चक्र अनियमित रह सकता है। स्तनपान बंद करने के 3 महीने बाद भी पीरियड्स न आएं तो डॉक्टर से सलाह लें। अपने मासिक चक्र की तारीखों को नोट करें। गंभीर दर्द होने पर ही स्वास्थ्य समस्या का संकेत मानें।","प्रसवानंतर अनियमित पाळी येणे सामान्य आहे, विशेषत: स्तनपान करत असताना. शरीराला बरे होण्यासाठी वेळ लागतो. ६-१२ महिन्यांपर्यंत चक्र अनियमित राहू शकते. स्तनपान बंद केल्यानंतर ३ महिन्यांनंतरही पाळी पुन्हा सुरू झाल्यास आरोग्य सेवकांचा सल्ला घ्या. आपल्या चक्राच्या तारखा नोंदवा. जोरदार वेदना झाल्याशिवाय त्याला आरोग्य समस्या आहेत अस समजू नका.","JSY Guidelines, Delivery Preparation"
Excessive Menstrual Bleeding and Pregnancy Risks,1. Can excessive bleeding in periods cause any problems during pregnancy or at the time of childbirth?,"Heavy periods before pregnancy don't always cause problems, but inform your doctor. They may check for anemia (low blood) which can make you tired. Eat iron-rich foods like dates and leafy greens. During pregnancy, any bleeding needs immediate medical attention. After delivery, normal bleeding lasts 4-6 weeks - if soaking >1 pad/hour, go to hospital.","गर्भावस्था से पहले भारी रक्तस्राव हमेशा समस्या नहीं होता, पर डॉक्टर को जरूर बताएं। वे एनीमिया (खून की कमी) की जांच कर सकते हैं। खजूर और हरी पत्तेदार सब्जियां खाएं। गर्भावस्था में किसी भी रक्तस्राव पर तुरंत ध्यान दें। प्रसव के बाद सामान्य रक्तस्राव 4-6 सप्ताह तक रहता है - यदि 1 घंटे में 1 से ज्यादा पैड भीगे तो अस्पताल जाएं।","गर्भधारणे  रक्तस्त्राव होणे हे  नेहमीच समस्या निर्माण करत नाही, तरी सुद्धा अशी समस्या झाल्यास त्वरित  डॉक्टरांना कळवा आणि योग्य तो उपचार घ्या. ते एनीमिया (रक्तकमतरेची) तपासणी करू शकतात. खजूर आणि पालेभाज्या भरपूर प्रमानात खा. गर्भारपणात कोणत्याही प्रारचा रक्तस्त्राव झाल्यास  लगेच लक्ष द्या. प्रसवानंतर सामान्य रक्तस्त्राव ४-६ आठवडे टिकू शकतो - प्रति तास १ पेपर पॅड भिजत असल्यास रुग्णालयात जा.","JSY Benefits, WHO Delivery Care"
Delivery At Referral Center,"1. How to know if I am required to deliver at the referral level
","You should deliver at a referral hospital if your pregnancy is high-risk or if your healthcare worker advises it due to complications. If your pregnancy is low-risk and without complications, you can safely deliver at a healthcare center or referral center, as these are equipped to manage normal deliveries. Always follow your healthcare worker’s advice, keep your hospital papers and money ready from the 8th month, and ask your ASHA worker for help with transport planning.","यदि आपकी गर्भावस्था उच्च जोखिम वाली है या यदि आपका स्वास्थ्य सेवा कर्मी जटिलताओं के कारण ऐसा करने की सलाह देता है, तो आपको रेफरल अस्पताल में प्रसव कराना चाहिए। यदि आपकी गर्भावस्था कम जोखिम वाली और जटिलताओं के बिना है, तो आप सुरक्षित रूप से स्वास्थ्य सेवा केंद्र या रेफरल केंद्र पर प्रसव करा सकती हैं, क्योंकि ये सामान्य प्रसव का प्रबंधन करने के लिए सुसज्जित हैं। हमेशा अपने स्वास्थ्य सेवा कर्मी की सलाह का पालन करें, 8वें महीने से अपने अस्पताल के कागजात और पैसे तैयार रखें, और परिवहन योजना के लिए अपने आशा कार्यकर्ता से मदद मांगें।","जर तुमची गर्भधारणा जास्त जोखीमची असेल किंवा तुमच्या आरोग्यसेवा कर्मचाऱ्याने तुमची प्रसूती गुंतागुंतीची आहे असा सल्ला दिला असेल तर तुम्ही रेफरल हॉस्पिटलमध्ये प्रसूती करावी.परंतु जर तुमची गर्भधारणा कमी जोखीमची असेल आणि गुंतागुंती नसेल तर तुम्ही आरोग्यसेवा केंद्र किंवा रेफरल सेंटरमध्ये सुरक्षितपणे प्रसूती करू शकता, कारण ते सामान्य प्रसूती व्यवस्थापित करण्यासाठी सुसज्ज आहेत. तुमच्या आरोग्यसेवा कर्मचाऱ्याच्या सल्ल्याचे नेहमी पालन करा, आठव्या महिन्यापासून तुमचे रुग्णालयाचे कागदपत्रे आणि पैसे तयार ठेवा आणि वाहतूक नियोजनासाठी तुमच्या आशा वर्करची मदत घ्या.",https://health.ucsd.edu/care/pregnancy-birth/giving-birth/low-intervention-birth/eligibility/    https://healthywa.wa.gov.au/Articles/U_Z/Your-maternity-care-options    https://kce.fgov.be/sites/default/files/2023-01/KCE_363_Referral_Low-risk_Pregnancy_Report.pdf    https://www.acog.org/clinical/clinical-guidance/obstetric-care-consensus/articles/2019/08/levels-of-maternal-care  
Delivery At Healthcare Center,1. How to know if I am required to deliver at the healthcare center,"You should deliver at a healthcare center or hospital if you have any of the following: very low blood level (severe anemia), high blood pressure or fits during pregnancy, bleeding during pregnancy, baby not growing well, previous problems in pregnancy, twins or baby not in head-down position, pregnancy after cesarean, diabetes, thyroid, heart or kidney problems, too much or too little water around the baby, or if you are very young (below 18) or older (above 35). These conditions can make your pregnancy high-risk and need special care from trained doctors and nurses. Always follow your healthcare worker’s advice for a safe delivery.","यदि आपको निम्न में से कोई भी लक्षण है तो आपको स्वास्थ्य सेवा केंद्र या अस्पताल में प्रसव कराना चाहिए: बहुत कम रक्त स्तर (गंभीर एनीमिया), गर्भावस्था के दौरान उच्च रक्तचाप या दौरे, गर्भावस्था के दौरान रक्तस्राव, बच्चे का ठीक से विकास न होना, गर्भावस्था में पिछली समस्याएँ, जुड़वाँ बच्चे या बच्चे का सिर नीचे की स्थिति में न होना, सिजेरियन के बाद गर्भावस्था, मधुमेह, थायरॉयड, हृदय या गुर्दे की समस्याएँ, बच्चे के आस-पास बहुत अधिक या बहुत कम पानी होना, या यदि आप बहुत छोटी हैं (18 वर्ष से कम) या बड़ी हैं (35 वर्ष से अधिक)। ये स्थितियाँ आपकी गर्भावस्था को जोखिमपूर्ण बना सकती हैं और प्रशिक्षित डॉक्टरों और नर्सों से विशेष देखभाल की आवश्यकता होती है। सुरक्षित प्रसव के लिए हमेशा अपने स्वास्थ्य सेवा कर्मी की सलाह का पालन करें।","जर तुम्हाला खालीलपैकी कोणती ही समस्या असेल तर तुम्ही आरोग्य केंद्रात किंवा रुग्णालयात प्रसूती करावी: खूप कमी रक्त पातळी (गंभीर अशक्तपणा), गर्भधारणेदरम्यान उच्च रक्तदाब किंवा झटके, गर्भधारणेदरम्यान रक्तस्त्राव, बाळाची वाढ नीट होत नाही, गर्भधारणेदरम्यान मागील समस्या, जुळे किंवा बाळ डोके खाली स्थितीत नसणे, सिझेरियन नंतर गर्भधारणा, मधुमेह, थायरॉईड, हृदय किंवा मूत्रपिंडाच्या समस्या, बाळाभोवती खूप जास्त किंवा खूप कमी पाणी, किंवा तुम्ही खूप लहान (१८ वर्षांपेक्षा कमी) किंवा त्याहून अधिक वयाचे (३५ वर्षांपेक्षा जास्त) असाल तर. या परिस्थितीमुळे तुमची गर्भधारणा जास्त धोकादायक बनू शकते आणि प्रशिक्षित डॉक्टर आणि परिचारिकांकडून विशेष काळजी घेणे आवश्यक आहे. सुरक्षित प्रसूतीसाठी तुमच्या आरोग्यसेवा कर्मचाऱ्याच्या सल्ल्याचे नेहमीच पालन करा.",http://www.nichd.nih.gov/health/topics/high-risk/conditioninfo/factors  https://www.msdmanuals.com/professional/gynecology-and-obstetrics/antenatal-complications/overview-of-high-risk-pregnancy   https://www.healthline.com/health/pregnancy/risk-factors 
