Theme,Questions,Answer,Hindi,Marathi,References
Sciatica in Pregnancy,"1. What is sciatica, and how does it affect pregnant women?","Sciatica is nerve compression in the lower back or hip region, causing sharp pain or a burning sensation down the leg. It can occur during pregnancy as the growing baby puts pressure on nerves. If you experience these symptoms, consult your doctor for proper management and relief. Avoid self-treatment without medical advice.","साइटिका पीठ के निचले हिस्से या कूल्हे के क्षेत्र में तंत्रिका संपीड़न है, जिससे पैर के नीचे तेज दर्द या जलन होती है। यह गर्भावस्था के दौरान हो सकता है क्योंकि बढ़ता हुआ बच्चा नसों पर दबाव डालता है। यदि आप इन लक्षणों का अनुभव करते हैं, तो उचित प्रबंधन और राहत के लिए अपने डॉक्टर से परामर्श करें। बिना चिकित्सकीय सलाह के स्व-उपचार से बचें।","सायटिका म्हणजे पाठीच्या खालच्या भागात किंवा कंबरेच्या भागात नसा दाबणे, ज्यामुळे पायात तीव्र वेदना किंवा जळजळ होते. गर्भधारणेदरम्यान वाढत्या बाळाच्या नसांवर दबाव येत असल्याने हे होऊ शकते. जर तुम्हाला ही लक्षणे जाणवत असतील तर योग्य व्यवस्थापन आणि आरामासाठी तुमच्या डॉक्टरांचा सल्ला घ्या. वैद्यकीय सल्ल्या घेणे स्वतःहून उपचार करणे टाळा.","NHM Postnatal Care, WHO Postpartum Depression"
Pelvic Pain in Pregnancy,1. Is it normal to experience pelvic pain during pregnancy? What can I do about it?,"Pelvic pain is common in pregnancy as your joints become softer and your body changes. Avoid heavy lifting or standing on one leg. Wear flat shoes and sleep with a pillow under your belly. A cloth belt around your hips may give support. Gentle pelvic floor exercises can help. If pain stops you from doing daily work or is severe, ask your doctor or a physiotherapist for help.",गर्भावस्था में पेल्विक दर्द सामान्य है क्योंकि आपके जोड़ ढीले हो जाते हैं और शरीर बदलता है। भारी सामान उठाने या एक पैर पर खड़े होने से बचें। फ्लैट जूते पहनें और पेट के नीचे तकिया लगाकर सोएं। कमर के चारों ओर कपड़े की बेल्ट सहारा दे सकती है। हल्की पेल्विक फ्लोर एक्सरसाइज करें। अगर दर्द से काम करना मुश्किल हो या बहुत तेज हो तो डॉक्टर या फिजियोथेरेपिस्ट से मदद लें।,गर्भाधारनेत  पेल्विक वेदना सामान्य आहे कारण सांधे कमकुवत होतात आणि शरीर बदलते. जड वस्तू उचलणे किंवा एका पायावर उभे राहणे टाळा. सपाट चपला वापरा आणि पोटाखाली उशी ठेवून झोपा. कंबरेभोवती कापडी पट्टा आधार देऊ शकतो. हलकी पेल्विक फ्लोर व्यायाम करा. वेदना काम करायला अडथळा आणत असल्यास किंवा तीव्र असल्यास डॉक्टर किंवा फिजिओथेरपिस्टचा सल्ला घ्या.,"NHM Breastfeeding Guide, WHO Breastfeeding"
Fatigue and Rest in Pregnancy,"1. Why do I feel more tired than usual during pregnancy, especially in the first trimester?
","Feeling extra tired is very normal, especially in the first trimester. Your body is working hard to grow your baby and adjust to big changes. Hormones like progesterone make you feel sleepy. This tiredness usually gets better after the first few months. If you feel very weak or dizzy, talk to your health worker for advice.","बहुत ज़्यादा थकान महसूस होना बहुत सामान्य है, खास तौर पर पहली तिमाही में। आपका शरीर आपके बच्चे को विकसित करने और बड़े बदलावों के साथ तालमेल बिठाने के लिए कड़ी मेहनत कर रहा है। प्रोजेस्टेरोन जैसे हॉरमोन आपको नींद का एहसास कराते हैं। यह थकान आमतौर पर पहले कुछ महीनों के बाद ठीक हो जाती है। अगर आपको बहुत कमज़ोरी या चक्कर महसूस हो, तो सलाह के लिए अपने स्वास्थ्य कार्यकर्ता से बात करें।","जास्त थकवा जाणवणे हे अगदी सामान्य आहे, विशेषतः पहिल्या तिमाहीत. तुमचे शरीर तुमच्या बाळाला वाढवण्यासाठी आणि मोठ्या बदलांशी जुळवून घेण्यासाठी कठोर परिश्रम करत असते. प्रोजेस्टेरॉन सारख्या संप्रेरकांमुळे तुम्हाला झोप येते. हा थकवा सहसा पहिल्या काही महिन्यांनंतर बरा होतो. जर तुम्हाला खूप कमकुवत किंवा चक्कर येत असेल तर सल्ल्यासाठी तुमच्या आरोग्य कर्मचाऱ्याशी बोला.",https://www.nhs.uk/pregnancy/related-conditions/common-symptoms/tiredness/   https://news.sanfordhealth.org/womens/first-trimester-fatigue/   https://share.upmc.com/2024/02/first-trimester-fatigue/  
"Night Sleep, Short Naps, Listen Body",1. How much rest should I aim for each day while pregnant?,"Try to sleep at least 8 hours at night. If you can, take short naps during the day but keep them under 30 minutes so you don’t feel groggy. Rest whenever you feel tired. Good sleep and rest help you and your baby stay healthy. Listen to your body and rest more if you need to.","रात में कम से कम 8 घंटे सोने की कोशिश करें। अगर आप कर सकते हैं, तो दिन में छोटी-छोटी झपकी लें, लेकिन उन्हें 30 मिनट से कम रखें ताकि आप सुस्त महसूस न करें। जब भी आपको थकान महसूस हो, आराम करें। अच्छी नींद और आराम आपको और आपके बच्चे को स्वस्थ रहने में मदद करते हैं। अपने शरीर की सुनें और ज़रूरत पड़ने पर ज़्यादा आराम करें।","रात्री कमीत कमी ८ तास झोपण्याचा प्रयत्न करा. शक्य असल्यास, दिवसा लहान झोपा घ्या पण त्या ३० मिनिटांपेक्षा कमी ठेवा जेणेकरून तुम्हाला थकवा जाणवणार नाही. जेव्हा तुम्हाला थकवा जाणवेल तेव्हा विश्रांती घ्या. चांगली झोप आणि विश्रांती तुम्हाला आणि तुमच्या बाळाला निरोगी राहण्यास मदत करते. तुमच्या शरीराचे ऐका आणि गरज पडल्यास अधिक विश्रांती घ्या.",https://www.healthline.com/health/pregnancy/excessive-sleeping-during-pregnancy   https://www.newtonbaby.com/blogs/pregnancy/how-many-hours-should-a-pregnant-woman-sleep    https://www.pregnancybirthbaby.org.au/sleep-during-pregnancy  
"Healthy Habits, Gentle Activity",1. How can I manage fatigue and ensure I get enough rest while handling daily chores?,"Ask for help from your family with chores so you can rest more. Take short breaks and lie down with your feet up during the day. Eat healthy foods, drink plenty of water, and try gentle walks or stretching. If you feel very tired, weak, or dizzy, let your health worker know.","अपने परिवार से कामों में मदद मांगें ताकि आप ज़्यादा आराम कर सकें। दिन के दौरान छोटे-छोटे ब्रेक लें और अपने पैरों को ऊपर करके लेटें। स्वस्थ भोजन खाएं, खूब पानी पिएं और हल्की सैर या स्ट्रेचिंग करें। अगर आपको बहुत थकान, कमज़ोरी या चक्कर महसूस हो, तो अपने स्वास्थ्य कार्यकर्ता को बताएं।","तुमच्या कुटुंबाची कामात मदत घ्या जेणेकरून तुम्ही जास्त आराम करू शकाल. दिवसभरात लहान विश्रांती घ्या आणि पाय वर करून झोपा. निरोगी अन्न खा, भरपूर पाणी प्या आणि हलके चालण्याचा किंवा स्ट्रेचिंग करण्याचा प्रयत्न करा. जर तुम्हाला खूप थकवा, अशक्तपणा किंवा चक्कर येत असेल तर तुमच्या आरोग्य कर्मचाऱ्याला कळवा.",https://www.nhs.uk/pregnancy/related-conditions/common-symptoms/tiredness/   https://www.cadenshae.com.au/blogs/news/10-ways-to-reduce-fatigue-during-pregnancy   https://timesofindia.indiatimes.com/life-style/parenting/pregnancy/pregnancy-fatigue-5-natural-ways-to-deal-with-tiredness-and-exhaustion/photostory/78810006.cms  
Postpartum Body Changes,1. How long does it take for my body to return to normal after giving birth?,"Most women feel mostly normal again by three months after birth, but it can take longer for some. Your body slowly heals and changes back. It is normal to feel tired, have some swelling, or notice bleeding for several weeks. If you have heavy bleeding, fever, or severe pain, tell your doctor right away.","अधिकांश महिलाएं जन्म के तीन महीने बाद फिर से सामान्य महसूस करने लगती हैं, लेकिन कुछ के लिए इसमें अधिक समय लग सकता है। आपका शरीर धीरे-धीरे ठीक होता है और वापस बदलता है। कई हफ़्तों तक थकावट महसूस होना, सूजन होना या रक्तस्राव होना सामान्य है। अगर आपको भारी रक्तस्राव, बुखार या गंभीर दर्द हो, तो तुरंत अपने डॉक्टर को बताएं।","बहुतेक महिलांना बाळंतपणानंतर तीन महिन्यांनी पुन्हा सामान्य वाटू लागते, परंतु काहींना यासाठी जास्त वेळ लागू शकतो. तुमचे शरीर हळूहळू बरे होते आणि पुन्हा बदलते. थकवा जाणवणे, सूज येणे किंवा काही आठवडे रक्तस्त्राव जाणवणे सामान्य आहे. जर तुम्हाला जास्त रक्तस्त्राव, ताप किंवा तीव्र वेदना होत असतील तर लगेच तुमच्या डॉक्टरांना सांगा.",https://www.medicinenet.com/how_long_does_it_take_to_recover_from_delivery/article.html    https://www.centrastate.com/blog/when-does-your-body-go-back-to-normal-after-pregnancy/   https://www.healthpartners.com/blog/what-to-expect-after-giving-birth/ 
"Body Healing, Emotional Changes, Care Support",1. What changes should I expect in my body after giving birth (the fourth trimester)?,"After birth, you may have bleeding, tender breasts, and mood changes as your body heals. Swelling and tiredness can last for weeks. Your body slowly returns to its pre-pregnancy state. Eat well, rest, and ask for help if you need it. If you feel very sad, have heavy bleeding, or severe pain, contact your doctor.","जन्म के बाद, आपके शरीर के ठीक होने के दौरान आपको रक्तस्राव, स्तनों में दर्द और मूड में बदलाव हो सकता है। सूजन और थकान कई हफ़्तों तक रह सकती है। आपका शरीर धीरे-धीरे गर्भावस्था से पहले की स्थिति में लौट आता है। अच्छा खाएं, आराम करें और ज़रूरत पड़ने पर मदद मांगें। अगर आपको बहुत दुख हो, बहुत ज़्यादा रक्तस्राव हो या बहुत ज़्यादा दर्द हो, तो अपने डॉक्टर से संपर्क करें।","बाळंतपणानंतर, तुमचे शरीर बरे होत असताना रक्तस्त्राव, स्तनांमध्ये वेदना आणि मूड बदलू शकतात. सूज आणि थकवा आठवडे टिकू शकतो. तुमचे शरीर हळूहळू गर्भधारणेपूर्वीच्या स्थितीत परत येते. चांगले खा, विश्रांती घ्या आणि गरज पडल्यास मदत घ्या. जर तुम्हाला खूप दुःख वाटत असेल, जास्त रक्तस्त्राव होत असेल किंवा तीव्र वेदना होत असतील तर तुमच्या डॉक्टरांशी संपर्क साधा.",https://www.whattoexpect.com/first-year/postpartum/what-doctors-wish-moms-knew-fourth-trimester/   https://www.pregnancybirthbaby.org.au/what-is-the-fourth-trimester    https://www.upmc.com/services/womens-health/services/obgyn/obstetrics/pregnancy/journey/after-baby  
Common Emotional Changes During Pregnancy,"1. What emotional changes should I expect during pregnancy?
2. Is it normal to feel anxious or overwhelmed during pregnancy?
3. Is it common to experience mood swings or emotional changes during pregnancy?
4. Why do I sometimes cry easily or feel sad during pregnancy?","It is normal to feel anxious, emotional, or have mood swings during pregnancy, especially for first-time mothers. These feelings are mainly due to hormonal changes and worries about childbirth or becoming a parent. Talking to your doctor about your concerns and practicing breathing exercises can help you feel better and more relaxed during this time.","गर्भावस्था के दौरान बेचैनी, भावनात्मकता या मूड में उतार-चढ़ाव महसूस होना सामान्य है, खासकर पहली बार माँ बनने वाली महिलाओं के लिए। ये भावनाएँ मुख्य रूप से हार्मोनल परिवर्तनों और बच्चे के जन्म या माता-पिता बनने की चिंताओं के कारण होती हैं। अपनी चिंताओं के बारे में अपने डॉक्टर से बात करना और साँस लेने के व्यायाम का अभ्यास करना आपको इस दौरान बेहतर और अधिक आराम महसूस करने में मदद कर सकता है।","गर्भधारणेदरम्यान चिंताग्रस्त, भावनिक किंवा स्वभावात बदल होणे सामान्य आहे, विशेषतः पहिल्यांदाच आई होणाऱ्यांसाठी. या भावना प्रामुख्याने हार्मोनल बदलांमुळे आणि बाळंतपणाबद्दल किंवा पालक होण्याच्या चिंतांमुळे असतात. तुमच्या चिंतांबद्दल तुमच्या डॉक्टरांशी बोलणे आणि श्वासोच्छवासाचे व्यायाम केल्याने तुम्हाला या काळात बरे आणि अधिक आरामदायी वाटू शकते.",WHO Iron & Folic Acid WebMD Iron in Pregnancy KidsHealth Folic Acid  https://www.themotherbabycenter.org/blog/2024/09/pregnancy-emotions/    https://www.nct.org.uk/information/pregnancy/wellbeing-and-lifestyle-pregnancy/common-emotions-when-expecting-baby    https://www.healthline.com/health/pregnancy/anxiety-coping-tips 
"Managing Stress, Mood Swings, and Seeking Help","1. How can I manage mood swings, stress & anxiety during pregnancy?
2. What are some simple ways to relax or feel better if I am feeling low during pregnancy?
3. Who can I talk to if I am feeling sad or worried for many days?","To manage stress or mood swings, try to rest, eat healthy foods, and take slow, deep breaths. Light walks, listening to music, or talking to someone you trust can help you feel better. Share your feelings with your family or a close friend. If you feel sad, anxious, or tired for more than two weeks, talk to your doctor, ASHA worker, or a counselor. There is help available, and you do not have to handle everything alone. Taking care of your mind is just as important as taking care of your body.","तनाव या मूड बदल को संभालने के लिए आराम करें, पौष्टिक खाना खाएं और धीरे-धीरे गहरी सांस लें। हल्की सैर, संगीत सुनना या किसी भरोसेमंद व्यक्ति से बात करना आपको अच्छा महसूस करा सकता है। अपनी भावनाएं परिवार या करीबी दोस्त से साझा करें। अगर दो हफ्ते से ज्यादा उदासी, चिंता या थकान महसूस हो तो डॉक्टर, आशा वर्कर या काउंसलर से बात करें। मदद उपलब्ध है, आपको सब कुछ अकेले संभालने की जरूरत नहीं। अपने मन का ख्याल रखना भी शरीर की देखभाल जितना जरूरी है।","तणाव किंवा स्वभाव बदल हाताळण्यासाठी विश्रांती घ्या, पौष्टिक अन्न खा आणि हळूहळू लांब  श्वास घ्या. हलके  चालणे, संगीत ऐकणे किंवा विश्वासू व्यक्तीशी बोलणे तुम्हाला बरे वाटू शकते. तुमच्या भावना कुटुंबाशी किंवा जवळच्या मित्राशी बोलत चला. दोन आठवड्यांपेक्षा जास्त काळ दुःखी, चिंताग्रस्त किंवा थकवा जाणवला तर डॉक्टर, आशा वर्कर किंवा समुपदेशकाशी बोला. मदत उपलब्ध आहे, तुम्हाला सर्व काही एकट्याने करायची गरज नाही. मनाची काळजी घेणे हे शरीराची काळजी घेण्याइतकेच महत्त्वाचे आहे.",WHO Physical Activity in Pregnancy ACOG Exercise Pregnancy
